,书名,豆瓣链接,评分,评分人数,作者国籍,作者,出版社,原作名,译者,出版日期,页数,价格,装帧,丛书,ISBN,内容简介,作者简介
0,窥视日本,https://book.douban.com/subject/1438461/,7.9,4510,日,妹尾河童,生活·读书·新知三联书店, ,陶振孝,2005-11,158,15.00,平装,妹尾河童作品系列,9787108023308,《窥视日本》是妹尾河童继《窥视印度》、《河童旅行素描本》之后，又一部构思新奇，视角独特的画书。作者这一次将视线聚集于自己的祖国——日本，从皇居到监狱，从锁具到文身，从豪华舒适的东方快车到日本的新干线……边写边画，巨细靡遗，其孩童般的好奇心跃然纸上。,妹尾河童，日本当代具代表性的舞台设计家，1930年生于神户，1954年因舞台设计而崭露头角，此后活跃于戏剧、歌剧、芭蕾舞、音乐剧、电视等表演艺术领域，曾获“纪伊国屋演剧”、“山多利音乐”、“艺术祭优秀”、“兵库县文化”等众多奖项。
1,活了100万次的猫,https://book.douban.com/subject/1257365/,9.0,18481,日本,佐野洋子,接力出版社, ,唐亚明,2004-10,30,28.00,精装, ,9787806795095,有一只100万年也不死的猫，其实它死了100万次，又活了100万次。是一只漂亮的虎皮花猫。有100万个人宠爱过它，有100万个人在它死的时候哭过，可是它连一次也没有哭过。 猫曾经是国王的猫。猫讨厌国王，国王总是发动战争，还把猫用一个漂亮的篮子装起来，带到战场上。有一天，猫被一只冷箭射死了。国王捧着猫哭了起来，仗也不打了，回到了王宫，把它埋在了院子里。 猫曾经是水手的猫。猫讨厌大海，水手带它走遍了全世界的大海和全世界的码头。有一天，猫从船上掉了下来淹死了。水手用网子把猫捞了上来，抱着它大哭起来，把它埋到了一个遥远的港口的树下。 猫还曾经是一个魔术师的猫、曾经是一个小偷的猫、曾经是一个孤零零的老太太的猫、曾经是一个小女孩的猫，它被锯死过、被狗咬死过、老死过，还被背孩子的带子勒死过，不过，它已经不在乎死亡了。 后来，猫就谁的猫也不是了。它成了一只野猫。它头一次变成了自己的猫。它最喜欢自己了，漂亮的虎皮花猫终于变成了漂亮的野猫。母猫们都想嫁给他，有的给它大鱼，有给它上等的老鼠，它说：“我可死过一百万次呢！”它比谁都喜欢自己。 只有一只猫连看也不看它一眼，一只美丽的白猫。它走过去说：“我可死过一百万次呢！”“是吗？”白猫只说了这么一声。它有点生气了，因为它太喜欢自己了。第二天、第三天，它都走到白猫的身边，说：“你还一次也没活完吧？”“是吗？”白猫只说了这么一声。有一天，它在白猫的面前翻了三个跟头，说：“我呀，曾经是马戏团的猫呢。”“是吗？”白猫只说了这么一声。“我呀，我死过100万次……”说到一半的时候，它问白猫，“我可以呆在你身边吗？”“行呀。”白猫说。就这样，它一直呆在了花猫的身边。 白猫生了好多可爱的小猫。它再也不说“我呀，我死过100万次……”了。它比喜欢自己，还要喜欢白猫和小猫们。 小猫们很快就长大了，走掉了。它满足地说：“它们都成了出色的野猫啦。”“是啊。”白猫说，嗓子眼儿里发出了温柔的“咕噜咕噜”声。白猫已经成了一个老奶奶了，它对白猫更温柔了，它想和白猫永远地活下去。 有一天，白猫在它身边静静地不动了。它哭了起来，从夜里哭到早上，又从早上哭到夜里，它哭了有100万次。一天中午，它的哭声停止了。它在白猫的身边静静地不动了。 猫再也没有起死回生过。,佐野洋子，日本著名绘本作家，出生于中国北京，毕业于日本东京武藏野美术大学设计系，曾在德国柏林造型大学学习石版画。
2,浮生六记,https://book.douban.com/subject/1088581/,8.7,69111, ,（清）沈复,人民文学出版社, , ,1999-1,80,38,平装,中国小说史料丛书,9787020028313,这是一部自传体文学的作品，原书六卷，已逸其二，现仅存四卷（有所谓“足本”者，后二记系伪作。书中记叙了作者夫妇间平凡的家居生活，坎坷际遇，和各地浪游闻见。文辞朴素，情感真挚，前人曾有“幽芳凄三角，读之心醉”的评语。本书文字不长，但向为文学爱好者和研究者所重视，影响广泛。,沈复（1763~？），字三白，号梅逸，江苏苏州人。年轻时秉承父业，以游幕经商为生，后偕妻离家别居，妻子客死扬州。46岁时有感于“苏东坡云‘事如春梦了无痕’，苟不记之笔墨，未免有辜彼苍之厚”，乃作《浮生六记》。
3,穆斯林的葬礼,https://book.douban.com/subject/1084082/,8.1,10687, ,霍达,人民文学出版社, , ,2005-1,659,33.00,平装,茅盾文学奖获奖作品全集,9787020049233,小说写一个穆斯林家族三代人半个多世纪的生活，歌颂回族人民自强不息的民族性格。古都京华老字号玉器行“奇珍斋”的主人梁亦清，原是回族低层的琢玉艺人，他家有两个女儿，长女君壁长于心计，次女冰玉娇小任性。一天有位长者带名少年去麦加朝圣路过梁家，少年被精美玉器所吸引，决定留下当学徒，这就是本书主人公韩子奇。师徒两人正为一件订货劳作，这是专做洋人卖买的“汇远斋”定做的“郑和航海船”。郑和是回族的英雄，他们决心做好这件光耀民族精神的作品，三年的精雕细刻将在中秋佳节完成。不料梁亦清突然晕倒在转动着的玉坨上，宝船被毁，人也丧命。为了抵债，韩子奇到“汇远斋”当了学徒，苦熬三年终成行家。他回到奇珍斋娶了长女君壁，决心重振家业，十年之后名冠京华，又得贵子取名天星，幸福度日。可是日寇侵华战争爆发，韩子奇担心玉器珍品被毁，随英商亨特来到伦敦。妻妹冰玉不顾姐姐反对，偷出家门执意随姐夫远行。在伦敦冰玉与亨特之子奥立佛相恋，可是奥立佛在伦敦大轰炸中却不幸丧生。韩子奇与梁冰玉在海外相依为命十年，旷男怨女终于结合并生下女儿新月。战后一同回国，姐姐收留新月为自己女儿，冰玉远走他乡。新月逐渐长大成人，以优异成绩考上北大西语系。上学后与班主任楚雁潮发生爱情，因楚系汉族，为梁家反对，他们的爱情却在阻挠中愈加炽热。可是红颜薄命，新月因严重心脏病不幸逝世，楚雁潮悲痛欲绝。,霍达，1945年生，回族，北京人，中央文史研究馆馆员。著有长篇小说《穆斯林的葬礼》《补天裂》《未穿的红嫁衣》，中篇小说《红尘》，报告文学《万家忧乐》《国殇》、《小巷匹夫》《民以食为天》，及影视剧本《鹊桥仙》《我不是猎人》《龙驹》等。
4,北京，北京,https://book.douban.com/subject/2297786/,7.4,12539, ,冯唐,重庆出版社, , ,2007-11,233,23.80,精装, ,9787536691452,《北京北京》，是冯唐“万物生长三部曲”的第三部，情节与风格都一脉相承。由青春步入成熟，从萌动收获迷惘，浓重的男性荷尔蒙是冯唐作品一贯最大的特色。 这是冯唐作品中气势最猛烈，如草原野火般的一部。这位语言的魔术师，以汹涌澎湃、聪明灵动的语言，述说着自己的北京往事。他一边说笑着，一边使坏着，当你惊叹着渐渐沉迷时，却突然发现巨大的悲伤悄然而至，漫天火焰消失，然后，只有淡淡的缕缕清烟。 这是梦想中的书。嚣张，迅烈，胆大妄为。,冯唐：男，1971年生于北京。协和医科大学临床医学博士，妇科肿瘤专业，美国Emory大学工商管理硕士。现居香港，就职于麦肯锡公司（McKinsey & Co.），从事旧时被称为军师、幕僚或师爷的工作。 著有长篇小说《万物生长》、《十八岁给我一个姑娘》、《欢喜》、《北京北京》，散文集《活着活着就老了》。
5,萧十一郎,https://book.douban.com/subject/1089518/,7.9,12925, ,古龙,珠海出版社, , ,2005-8,413,19.00,平装,古龙作品集,9787806070598,,古龙，本名熊耀华，原籍江西。古龙毕业于台湾淡江大学外文系，是台湾著名新派武侠小说作家。他从1960年创作《苍穹神剑》始，一生共写了近70部武侠小说，影响巨大。其代表作有《风云第一刀》、《绝代双骄》、《楚留香传奇》系列、《陆小凤传奇》、《七种武器》系列、《白玉老虎》、《流星·蝴蝶·剑》等。
6,老人与海,https://book.douban.com/subject/1017841/,8.4,3967, ,海明威(美),世界图书出版公司, , ,1989-10,153,8.00,平装, ,9787506204392,《老人与海》的故事相当简单。老渔民桑提亚哥出海捕鱼，84天一无所获。然而他并不因此丧失信心，继续出海，经过两天两夜的苦战终于捕到一条罕见的大鱼。返航时他不幸遇上鲨鱼群，虽全力拼搏仍寡不敌众，等抵岸时大鱼只剩下了一副骨架。但这个并不复杂的故事却意义深邃，是海明威的人生哲学和创作技巧的集中表现，也是一部可以从不同侧面或层次去阅读的小说。,
7,没有教不好的学生,https://book.douban.com/subject/1441869/,8.9,5439, ,梁星乔,中国大百科全书出版社, , ,2003-9,270,26.00,平装, ,9787500069270,《没有教不好的学生:一代名师霍懋征爱的教育艺术》每篇故事后均附有林崇德教授及其弟子李玉华先生的点评。林先生是北京师范大学教学指导委员会主任、博士生导师，是我国当代著名的心理学家和教育家。他们从心理学、教育学的角度对每一个故事加以点评，为霍老师的教育思想和教育方法提供了科学的依据。,
8,Harry Potter and the Deathly Hallows,https://book.douban.com/subject/1975797/,9.0,8902, ,J.K.Rowling,Arthur A. Levine Books, , ,2007-7-21,784,34.99美,Hardcover,The Harry Potter Series (American Version),9780545010221,"Harry has been burdened with a dark, dangerous and seemingly impossible task: that of locating and destroying Voldemort’s remaining Horcruxes. Never has Harry felt so alone, or faced a future so full of shadows. But Harry must somehow find within himself the strength to complete the task he has been given. He must leave the warmth, safety, and companionship of The Burrow and follow without fear or hesitation the inexorable path laid out for him. In this final, seventh installment of the Harry Potter series, J.K. Rowling unveils in spectacular fashion the answers to the many questions that have been so eagerly awaited. The spellbinding, richly woven narrative, which plunges, twists and turns at a breathtaking pace, confirms the author as a mistress of storytelling, whose books will be read, reread and read again. Harry is waiting in Privet Drive. The Order of the Phoenix is coming to escort him safely away without Voldemort and his supporters knowing – if they can. But what will Harry do then? How can he fulfil the momentous and seemingly impossible task that Professor Dumbledore has left him with?","J. K. 罗琳（J. K. Rowling, 1965- ），英国女作家，自小喜欢写作，当过短时间的教师和秘书。二十四岁那年，她在前往伦敦的火车旅途中萌生了创作“哈利·波特”系列小说的念头。七年后，《哈利·波特与魔法石》问世，之后她陆续创作了《哈利·波特与密室》《哈利·波特与阿兹卡班囚徒》《哈利·波特与火焰杯》《哈利-波特与凤凰社》《哈利·波特与“混血王子”》和《哈利·波特与死亡圣器》，完成了该系列的创作，在全球刮起一股股“哈利·波特”飓风，在世界范围内掀起规模宏大的“哈利·波特”阅读狂潮。另外，在此期间，她还因为慈善事业而先后完成了《神奇动物在哪里》和《神奇的魁地奇球》这两部与“哈利·波特”系列相关的图书，最新完成的作品是《诗翁彼豆故事集》。 J.K.罗琳与她的丈夫及三个孩子生活在爱丁堡，一边尽享家庭生活的幸福，一边文学创作。"
9,点石成金,https://book.douban.com/subject/1827702/,8.4,7162,美,史蒂夫·克鲁克,机械工业出版社, ,De Dream',2006-8,147,39.00,平装, ,9787111184829,可用性设计是Web设计中最重要也是最困难的一项任务。《点石成金》的作者根据自己多年从业的经验，剖析用户的心理，在用户使用的模式、为浏览进行设计、导航设计、主页布局、可用性测试等方面提出了许多独特的观点，并给出了大量简单、易行的可用性设计的建议。这本书短小精悍，语言轻松诙谐，书中穿插大量色彩丰富的屏幕截图、趣味丛生的卡通插图以及包含大量信息的图表，使枯燥的设计原理变得平易近人。 此书适合从事Web设计和Web开发的技术人员阅读，特别适合为如何留住访问者而苦恼的网站/网页设计人员阅读。,
10,貧窮貴公子,https://book.douban.com/subject/1921479/,8.2,6870,日,森永あい / 森永爱,东立出版社,山田太郎ものがたり, ,2001, , , , ,9787204075386,有一位两年前只留下一句「我出去一下」就失踪的父亲；一位无论把钱藏在哪都一定会被找出来而且会被花在最无用的地方的母亲；再加上六位在上小学的弟妹…… 身为名门「一宫高校」的特优生兼校园偶像的山田太郎，住在外观像仓库的房子过着一个月伙食费三万日币的日子。然而！如此贫困的生活却依然难以磨灭他那天生高贵的气质，并因此引发了一连串的故事……,森永爱（????-04-28-），日本漫画家。大学时代开始创作《灌篮高手》的同人志。1993年在增刊《COMIC_DX》上发表《第十一年的女神》，出道后发表的作品中，以1996年开始在月刊《ASUKA》上连载的《贫穷贵公子》最为有名。作品选择了少女漫画中罕见的“贫穷”为主题无论故事情节还是绘画都极尽夸张搞笑之能事，同时人物又不失美形，受到读者的热烈欢迎。《贫穷贵公子》完结后，于2001年在《ASUKA》3月号上连载的《丑小鸭王子》，同样是一部夸张暴笑的作品。目前正在《动漫前线》上连载的《闪亮亮之星》同意是一部夸张有趣的作品。
11,盗墓笔记3,https://book.douban.com/subject/2298149/,8.4,39725, ,南派三叔,中国友谊出版公司, , ,2007-11,274,26.80,平装,盗墓笔记,9787505723856,十年前，顺子的父亲带领一批神秘人进入茫茫的大雪山，闯入凶险莫名的地宫墓室，发现了数不胜数的金银财宝，但他们非但不能带着这些财宝离开，反而被困此地，几乎全部死于非命。 十年后，“我们”和顺了一行人再次踏足云顶天宫，这更是一次直逼死亡的惊险大穿越：昆仑胎、墙串子、百足神龙等前所未见的怪异事物接替出现，藏尸阁、排道、火山口、门殿、殉葬渠等诡异恐怖之所带来超强的感官刺激…… 云顶天宫是一代奇人汪藏海为万奴王修建的陵墓吗？上次出现在海底墓穴中的土夫子几乎齐聚云顶天宫，两地之间究竟有什么奇怪的联系？ 三叔总是在最令人感到意外的时机出现。三叔的出现就意味着谜团的最后答案，但这些谜团意然又要追溯到五十年前，而真相远远不止这些。一切的现象表明，更加恐怖、惊悚的场景已经到来……,南派三叔（1982年2月20日— ），本名徐磊，男，浙江人，现居杭州。超级畅销书作家。他的《盗墓笔记》系列与另一位作家的《鬼吹灯》系列共同开启了中国小说界的“盗墓时代”。
12,不去会死！,https://book.douban.com/subject/4618225/,8.2,22573,日本,石田裕辅,上海译文出版社,行かずに死ねるか! 世界9万5000km自転車ひとり旅,刘惠卿,2010-4,318,28.00,精装,石田裕辅系列,9787532750160,石田裕辅原是普通上班族，小学时在路边看到一位青年骑着载满行囊的自行车飞驰而过，那身影成为他潜意识里追逐的形象。于是，长大后发下“不去会死”的豪语，辞掉人人称羨的大企业工作，踏上世界之旅。 但石田在第一站阿拉斯加就被黑人女生勒索一美元，吓得躲在青年旅馆不敢出门；在秘鲁沙漠被持枪强盗抢个精光，还得横渡暴风地狱巴塔哥尼亚；在北极圈为了省钱洗露天冰河澡……就这样几度软弱，几度山穷水尽，几度想放弃，最后终于完成壮阔的五大洲完骑世界纪录。 “我看到恒河的纯白日出、萨宾娜天真无邪的笑脸、土耳其那尔汀美丽的笑容；满月下的金字塔、在草原上奔跑的长颈鹿、骑着破烂脚踏车追赶我的保保。泰西亚有点恼怒地笑着，流下稚气未脱的泪水。大海般的丛林中浮现蒂卡尔神殿，以及纪念碑谷神圣的风光。雄壮的育空河流淌而过，有鲑鱼跳跃着；在夜空中摇曳的极光……”经历过许多生死绝境、哀痛的别离、幸福的瞬间后，“活着真好”的体悟，是梦想带给石田最珍贵的礼物。,石田裕辅（Yusuke Ishida），1969年出生。高中一年级骑自行车环游和歌山县一周后，开始憧憬旅行。高中二年级达成“环游近畿一周”；大学时休学一年，完成“环游日本一周”。1995年辞去食品制造企业的工作，踏上环遊世界之旅。在旅途各地写下老套的歌词，画了风景和人物的素描，并且自我陶醉着。 石田裕辅创下的纪录： 1、日本自转车探险协会（JACC）的自行车环游世界纪录保持者（亚军）。 2、5300美金环游世界7年半（期间被强盗抢劫2900美金，旅途中打工收入不明）。 3、在秘鲁被强盗持枪洗劫一空，双手被缚，光着屁股倒在沙漠中，贞操险些失守。这一幕在自行车骑士间广为流传，之后还登上了日本电视节目。 p.s. 石田擅长钓鳟鱼、自制鳕鱼干，并在极圈附近为了省钱用河水洗澡（这就是用5300美金撑过7年半的秘密？）
13,亦恕与珂雪,https://book.douban.com/subject/1012747/,7.2,8937, ,蔡智恒,新世界出版社, , ,2004-05,285,20.00,平装, ,9787801871671,一位学画的女孩“珂雪”与一位学理工的男孩“亦恕”，当艺术与科学相遇，不同的理念背景，对于爱情的期待与表现截然不同，就因为不同，所以他们的爱情可以非常丰富。亦恕，一个学科学的理工男，聪明、独特的幽默能力，凡事有原则，思考喜欢讲逻辑，就连爱情也是。 在工作的同时也尝试写作。他，很像蔡智恒。珂雪，一个学艺术的美丽女孩，聪颖、感觉细腻，当面对无法解释的事情，她会画给你看，自然散发的柔柔情愫。她，就像你我都认识一位邻家女孩。亦恕在思考小说创作的同时，用原子笔随手画出的一幅图画，“一个箭靶与一支正射出的一只箭，再加上几条虚线”，而珂雪竟可以听到他想要表达的，“嘘嘘”箭的声音，他们认识了。哈，痞式幽默。透过创作他们了解对方的故事，走进彼此的世界，也在对方的创作中，扮演了一个重要的角色。 从相互的创作，看见对方的生活，也看见对方在心中的地位，而彼此故事的结局也会相同吗？等你来找到答案。两个爱情故事，一个看在你的眼里，一个发生亦恕与珂雪的笔中，有生活、有爱情、有友情，更贴近蔡智恒的真故事。让蔡智恒带着你，将小说迈入更宽广的领域。 一个学艺术的女孩与一个学科学的男孩，用一只画笔，顺着你的心画下爱情的符号，让你我可以走出绚丽的爱情迷宫。,蔡智恒，全球华文地区E世代天王级作家，昵称痞子蔡，JHT。 1969年生，台湾成功大学水利工程博士。1998年于BBS发表第一部小说《第一次的亲密接触》，造成全球华文地区的痞子蔡热潮。自此以后，左脑创作小说，右脑书写学术论文，独树一帜。 写作对他来说，是一种想说话的欲望。为了这种欲望。会在脑海中追逐文字，在计算机前自言自语。现于成大担任博士后研究员，兼任助理教授之职。 个人网站：http://www.jht.idv.tw，电子信箱：jht@gigigaga.com.
14,消失的密室,https://book.douban.com/subject/1419882/,8.9,6063,英,J·K·罗琳,皇冠文化出版公司, ,彭倩文,2001-1,396,新台币280,平装,哈利波特,9789573317586,『密室已經打開了。傳人的仇敵們，當心了……』 這到底是什麼樣的預警？密室又究竟在哪裡？ 才一開學，魔法學校裡卻怪事連連：先是管理員飛七的貓，不知道為什麼竟然被『石化』！然後學校裡的學生，也一個接一個慘遭毒手……難道這些慘劇都和密室的預警有關？而傳言中『毀滅麻種』的恐怖事件，是否正在祕密進行？為了解開這一連串駭人聽聞的謎團，哈利波特勢必得找到密室，但他也正一步步接近致命的危機……,J.K.羅琳：全世界最會說故事的魔法媽媽。一九九〇年，二十四歲的羅琳，坐在前往倫敦的誤點火車上，『哈利波特』咻地闖進了她的生命。透過車窗，彷彿看見了一個黑髮瘦弱、戴著眼鏡的小巫師在對她微笑。十年後，『哈利波特』成了風靡全球的童話人物。從小就喜歡寫作的羅琳，是個單親媽媽，因為找不到工作，只能靠著微薄的失業救濟金養活自已和女兒。為了逃離又小又冷的房間，她總是窩在住家附近的尼可森咖啡館裡寫作；因為沒錢點餐，所以每次只點上一杯卡布奇諾，一字一字的寫下『哈利波特』的故事。結果，《哈利波特》才一出版，便以驚人的魔力風靡全球，羅琳在一夕之間，就從不為人知的貧單親媽媽，一躍成為蜚聲國際的暢銷作家。《哈利波特》在全世界所折起閱讀風潮，更被譽為『文學界的披頭四狂熱』。羅琳說，《哈利波特》是一本會帶給她快樂的書，顯然毫無疑問的，對讀者來說也是一樣的！
15,布瓜的世界,https://book.douban.com/subject/1048537/,8.3,5740, ,幾米,辽宁教育出版社, , ,2002-11,128,25.00,平装,幾米作品精选集,9787538264616,《布瓜的世界》沿袭了幾米一贯的浪漫主义风格，借由儿童天真的视角展现都市生活的绚丽多情。“布瓜”是译文“为什么”的音译，而这本书的源起也是因幾米的小女儿成天询问“为什么”，幾米因此效仿提出了一串串的“为什么”，将浪漫的想象与现实生活融为一体，使作品中充满了诗意与睿智的灵魂。 相比以前，《布瓜的世界》采用了“多格”的形式，最多的一页画了70个小格子，70条小鱼儿在其中自由游弋，而文字方面也凸显了一点点锋芒，使人沉浸在幾米温柔书香的同时，又多了一点点个性的体味。,畿米，台湾绘本作家。台湾中国文化大学美术系设计组毕业，曾在广告公司担任美术指导12年。 畿米住在台北，在家工作，为报纸、杂志、各种出版品提供图画，他喜爱现在的绘本创作事业。1998年开始创作，1999年以《向左走·向右走》一举成名，掀起港台绘本热潮。目前有多本广受欢迎的作品，卖出美、德、法、希腊、日、韩等多种版本。 作品：1998年《森林里的秘密》、《微笑的鱼》；1999年《向左走·向右走》、《月亮忘记了》、《听畿米唱歌》；2000年《黑白异境》、《森林唱游》、《我的心中每天开一朵花》；2001年《地下铁》、《照相本子》。
16,中国少年儿童百科全书,https://book.douban.com/subject/1000534/,9.3,4991, ,王德胜,浙江教育出版社, , ,1994,619,37.50,精装,中国少年儿童百科全书,9787533819460,自然，环境是哺育人类的摇篮，从远古到今天，它不断为人类提供生存和发展的条件，人类应当热爱自然，保护环境。《自然 环境》卷包括宇宙的演化，大地的变迁，生物的进化，动植物形态，人体构造等广泛领域，把大自然的一切，大到宇宙洪荒，小到微生物界，这些千变万化的奥妙和秘密，现象和本质，规律和变异，现在和将来，形象地展现在小读者面前，让他们从小领略大自然丰富多彩的风貌，无穷复杂的变化；了解人类征服自然、改造环境的巨大进展，汲取有益的营养。,
