,书名,豆瓣链接,评分,评分人数,作者国籍,作者,出版社,原作名,译者,出版日期,页数,价格,装帧,丛书,ISBN,内容简介,作者简介
33,我的精神家园,https://book.douban.com/subject/1482200/,9.0,6184, ,王小波,中国人民大学出版社, , ,2006-1,185,16.80,平装, ,9787300070513,《我的精神家园》是王小波杂文作品的精选，这些作品内容深刻而幽默、思维独特，带给读者精神上极大的乐趣。 王小波以经验主义和自由主义为其思想渊源，站在平民的视角，用平民的写作方式，以犀利的批判意识，为我们展示了一个纯粹的精神家园，给这个世界带来了一道闪电，照亮了许多人的心。我们在他的精神家里中穿行着，感受着他对思想、对自己、对写作的真诚、徜徉其中，我们分明听见了他从天堂里发出的笑声和他充满机智妙趣的耳语。,王波于1952年生于北京。中学毕业后在云南、山东等地下乡，先后做过农场职工、农民、工人和民办教师。曾就读于中国人民大学和美国匹兹堡大学。在北京大学和中国人民大学任过教，最终辞职，专事写作。1997年辞世，被誉为中国的乔伊斯。
34,偷偷爱着你,https://book.douban.com/subject/2063819/,8.0,8278, ,中条比纱也,白泉社, , , , , ,平装, ,9789861731964,憧れの人に会う為に、アメリカから桜咲学園に転入した少女・芦屋瑞稀。だけどそこは男子校で…瑞稀の男子校での生活を描いた「花ざかりの君たちへ」全23巻。,"中条比纱也（NAGAJO HISAYA）： 生日：9月12日 星座：处女 血型：B型 出生地：大阪 向各位征集作者照片 履历——中条是这两年急速窜红的作者。成名作品《偷偷爱着你》的连载前期，她还在给其他漫画家做助手，现在她已经是《花与梦》的主打作者之一。对于《偷偷爱着你》这部作品，瑞稀这个爱做梦的少女不惜女扮男装去追求自己憧憬的对象，这个最初的塑造很是吸引入，加上后来出现的各种的怪人，以初出道的漫画家而言已是难能可贵。但是她毕竟是唯美派少女漫画家，因此下在人物设定上面的力气要比剧情多的多。 喜欢的电影：《ID4》、《这个杀手不太冷》、《生死时速》、《异形》、《蔷薇的名字》、《侏罗纪公园》、《砂之惑星》、《STAND BY ME》…… 喜欢的食物：汤类食物,豆腐料理,混有肉、鱼、蔬菜等加汤炖煮成的乌冬或是咖喱乌冬。 偶像：TOKIO、KINKI KIDS、岛田绅介、中谷美纪…… 收藏品：天使物品、特别是天使翼的设计品 作品： 《心之果实》 《青涩梦幻曲 》全1卷 《纯情失意症》全2卷 《偷偷爱着你》 《二人法则》 《真夏犯罪者》 《17罗曼司》 《消失的声音》 《夏之栏》 《砂糖公主》 《Wild kiss》 《渴望之月》 《For You》"
35,卡尔维诺文集（第三卷）,https://book.douban.com/subject/1066165/,9.3,4439,意,伊塔洛·卡尔维诺,译林出版社, ,吴正仪,2001-9,404,21.00,精装,译林世界文学名著·现当代系列,9787806570968,卡尔维诺钟爱童话这一艺术形式，熟稔童话的特征、手法，自然也偏爱在小说中运用童话的手法来写现实的人和事。《我们的祖先》是这一艺术手法占主导地位的标志。 《我们的祖先》三部曲，由《分成两半的子爵》（1952）、《树上的男爵》（1957）、《不存在的骑士》（1959）三部小说组成。 三部曲没有一个共同的人物或共同的情节脉络来把它们连缀；但共同的思想内涵，共同的艺术探索，把它们合成一个有机的整体，即这三部小说都采用童话的手法，来表现当代社会里的人被摧残，苦苦追求自身的完整性的遭际。,伊塔洛·卡尔维诺（1923-1985）是意大利当代最有世界影响的作家。他在四十年的创作实践中，不断探索和创新，力求以最贴切的方法和形式表现当今的社会和现代人的精神，以及他对人生的感悟和信念。他的作品风格多样，每一部都达到极高的水准，表现了时代，更超越了时代。他于1985年猝然逝世，而与当年的诺贝尔文学奖失之交臂，但他在国际文坛上的影响与日俱增，他的创作日益受到人们的关注。
36,Level E,https://book.douban.com/subject/1370274/,9.3,6011, ,富樫義博,集英社授權天下出版, ,蘇錦明,1995, , , , ,9789625858692,充滿意外和幽默感的外星人王子,
37,我们去哪儿,https://book.douban.com/subject/1868896/,7.7,5318, ,Benjamin,中信出版社, , ,2006-8,153,24.00,平装16开, ,9787508607108,《我们去哪儿》是开本、厚度和《地下室》差不多的一本书，而这本小说和《地下室》的区别是：《地下室》重男人情义；《我们去哪儿》尝试写写那些风里雨里的所谓爱情。 这部带有自传体色彩的长篇小说是漫画写手本杰明在历经一年，认真体会日韩漫画和畅销小说的风格后，揣摩其人物、语言、场景变换的特点，推出的新作。《我们去哪儿》代表着80后第一次对生活发出了成熟的质疑。 漫长的时间漫长的等待，这本书里的每一件小事，跨越了作者在北京的整整三年。书里的每一个主角，每一个姑娘，每一个少年。在这三年里笑着出现，然后隐没，失败在风里。 似水的流行狂风中少年黑发丝丝消散，青春的身材瘦弱了又强悍最终还是拱低了腰背；姑娘们纷纷盛开然后再次老去，曾经的美丽避开了日光不敢看镜子；热血青年变成没出息小资。 再一次唏嘘时间过得真快，而叹气声还未落地，春夏一晃太阳昏黄了。时光用更快更快的速度飞逝，铁面无私从未停止。完全不理睬我们的成长，骄傲，伤心，成功和堕落。为什么如此脆弱的身躯被时光拽着飞跑，竟然没有纷纷散了架？一种的磕磕绊绊坑坑洼洼，我们残缺不全的尸骨，丢散在每一个快乐和美好。,张彬（BENJAMIN），毕业于大连轻工业学院服装设计专业。1998年9月赴天津。绘画了短篇漫画《Sena与情人》。1999年5月，回到北京，靠大量的兼职广告工作生活。2000年3月，创作了短篇漫画《夏天没有的花》。同时和几个志同道合的好友组织了“赤红漫画社”。作品相继在漫画主流媒体上发表，并尝试用CG进行创作，并出版过相关书籍。作品厚重尔飘渺，有极强的感染力，以写实尔达意境为主。 主要作品： 《夏天没有的花》<漫友> ，《下午课堂的幻想》 <梦幻总动员> ，《SENA & 情人》<科幻世界画刊> 。著有画集《ONE DAY》、《REMEMVER》，小说《地下室》等。
38,吉祥寺咖啡屋,https://book.douban.com/subject/1898609/,8.1,5425, ,宮本夕生,Wiley, , ,2002-9-9,640,940.00,Hardcover, ,9780470841471,舞台は東京都武蔵野市、若者が行き交う吉祥寺のとあるカフェ。そこはお店の外観が変っていたり、内装がとてもオシャレだったり、メニューが独創的だったりするわけではなくごくごく普通のカフェである。紅茶やコーヒーの香りが立ち込める、どこの街にもありそうなカフェなのだがそこのメニューにあるケーキ等のスイーツはとても人気で、更にそこで働いている男の子達も人気の的なのであった。 超が付くほどの潔癖症でしっかり者で店のチーフを務めている栗原太郎、その太郎と犬猿の仲で美女が絡むと意欲100倍で突っ走るフロア担当の大久保真希、ケーキ作りの一流だがかなりの不気味さを兼ね備えたキッチン担当の皆川ひふみ、体育大に通う貧乏学生で、仕事ではドジばかりしているものの何処か憎めない面を持つアルバイトの徳見秀太、家がお金持ち、女の子の容姿でおっとりしているかと思いきや、キレると信じられないような怪力を披露する一ノ宮純。後に登場するアマゾン帰りの元傭兵でオカマ言葉を使う筋骨隆々にしてサバイバル能力の持ち主・菜積浩伸と言ったそれぞれに個性を持った6人の若者たちが繰り広げる、思わず微笑んでしまうようなドタバタ劇である。もはやカップや食器が割れる音はBGMと化している。そして6人の行動・言動にストレスが溜まり、胃を痛める日々が続くマスター・三鷹雄一。そしてさらにCafe吉祥寺の前に堂々と立ちはだかる牛丼屋の店長である桃子。カフェ激戦区・吉祥寺での営業を続けていくことができるのか。果たして…。,
39,怪诞心理学,https://book.douban.com/subject/3908032/,7.3,18519,英,理查德·怀斯曼,天津教育出版社,Quirkology: The Curious Science of Everyday Lives,路本福,2009-07-01,268 页,25.00,平装, ,9787530957554,你走路的方式会透露出你的哪些性格？为什么女性的征婚广告最好由男性来写？全世界最好笑的笑话是什么？为什么有些人竟然会回忆起不曾发生过的事情？为什么女性驾驶员更容易超速行驶？夏天出生的人和冬天出生的人谁的运气更好一些？真心的笑容和虚假的笑容都打着哪些难以掩饰的烙印？…… 本书是作者和诸多卓越心理学家研究成果的结晶。它为读者打开了一扇重新认识自己和他人的窗户，书中的实验让我们意识到：其实人类的行为并不像我们想象的那么难以预测。这些独具匠心的实验读来一定会让你回味无穷、拍案叫绝，如果将其作为茶余饭后的谈资或用来搞活聚会气氛也会是一个不错的选择。,理查德·怀斯曼（Richard Wiseman），拥有“英国大众心理学传播第一教授”的头衔，他在包括欺骗、运气、幽默和超自然等不寻常领域的研究享誉国际，他是英国媒体最常引用的心理学家，他的研究在英国超过150个电视节目上播出。他定期出现在英国广播公司第四电台做节目，有关他工作的专题报道更是频频出现在英国各大出版社和报刊杂志上。
40,经济学原理（上下）,https://book.douban.com/subject/1028842/,9.1,21694,美国,格里高里·曼昆,机械工业出版社, ,梁小民,2003-8,323；410,88.00,平装,华章教材经典译丛,9787111126768,此《经济学原理》的第3版把较多篇幅用于应用与政策，较少篇幅用于正规的经济理论。书中主要从供给与需求、企业行为与消费者选择理论、长期经济增长与短期经济波动以及宏观经济政策等角度深入浅出地剖析了经济学家们的世界观。,"N. 格里高利·曼昆（Nicholas Gregory Mankiw, 1958- ），美国经济学家。29岁即成为哈佛大学历史上最年轻的终身教授之一。曾就读于麻省理工大学、普林斯顿大学。现为哈佛大学经济学教授，同时担任马萨诸塞州剑桥的一个非营利性智囊团——国家经济研究局所属的货币经济计划部主任，还被聘为国会预算办公室及波士顿联邦储备银行的顾问。曼昆同时还供职于ETS考试研发委员会下的经济学高阶水平考试委员会和NBER商业周期委员会。"
41,阿茲卡班的逃犯,https://book.douban.com/subject/1401161/,8.9,5708,英,J·K·罗琳,皇冠文化出版公司, ,彭倩文,2001-7,507,新台币299,平装,哈利波特,9789573318002,『佛地魔的僕人已被束縛了十二年之久，今晚午夜以前，他將幫助佛地魔東山再起……』 哈利波特升上三年級了，占卜學教授卻對他發出可怕的預言，到底『佛地魔的僕人』指的是誰？ 暑假才剛要結束，阿茲卡班監獄就發生了空前的越獄事件！傳言逃犯天狼星·布萊克就是十三年前出賣了詹姆和莉莉的人！現在他將矛頭指向哈利波特，因此連一向安全的霍格華茲學校，也進駐了魔法界最令人膽寒的獄卒『催狂魔』負責守護，校園裡一片風聲鶴唳！ 除了要防範天狼星·布萊克的偷襲行動，更讓哈利波特覺得丟臉的是，他一碰到全身罩著斗篷、陰森恐怖的『催狂魔』就會昏倒！同時寒意竄入他的胸膛、腦袋裡不斷出現莫名的尖叫聲，並吸去他所有快樂的感覺。哈利波特要如何對抗『催狂魔』的威脅，並趕在午夜時限到達之前，找出潛伏的佛地魔僕人，阻止一場大災難的發生呢？,J.K.羅琳：全世界最會說故事的魔法媽媽。一九九〇年，二十四歲的羅琳，坐在前往倫敦的誤點火車上，『哈利波特』咻地闖進了她的生命。透過車窗，彷彿看見了一個黑髮瘦弱、戴著眼鏡的小巫師在對她微笑。十年後，『哈利波特』成了風靡全球的童話人物。從小就喜歡寫作的羅琳，是個單親媽媽，因為找不到工作，只能靠著微薄的失業救濟金養活自已和女兒。為了逃離又小又冷的房間，她總是窩在住家附近的尼可森咖啡館裡寫作；因為沒錢點餐，所以每次只點上一杯卡布奇諾，一字一字的寫下『哈利波特』的故事。結果，《哈利波特》才一出版，便以驚人的魔力風靡全球，羅琳在一夕之間，就從不為人知的貧單親媽媽，一躍成為蜚聲國際的暢銷作家。《哈利波特》在全世界所折起閱讀風潮，更被譽為『文學界的披頭四狂熱』。羅琳說，《哈利波特》是一本會帶給她快樂的書，顯然毫無疑問的，對讀者來說也是一樣的！
42,荷包里的单人床,https://book.douban.com/subject/1032945/,7.7,7557, ,张小娴,南海出版公司, , ,2001-1,172,12.00,平装,张小娴作品集,9787544217644,作者1997年5月完成这部作品。这是一个关于暗恋的故事。女主角苏盈苦苦地暗恋着秦云生。运云生虽然最后接受了她，但他心里思念的，是一个永远不会回来的女人。无论苏盈多么努力，他最爱的，始终是一个逝去的情人。苏盈伤心地说：“世上最遥远的距离，不是生与死的距离，不是天各一方，而是我站在你面前，你却不知道我爱你。” 最遥远的距离，是你心里没有我。,张小娴：香港女作家。1995年推出第一部长篇小说《面包树上的女人》而走红文坛，继亦舒之后，成为香港最受欢迎的言情小说家。她的作品善于描写都市的男欢女爱，深受年轻读者的欢迎，往往新作一出版就会登上畅销榜。
43,蜂蜜與四葉草 1,https://book.douban.com/subject/1418297/,9.2,8399, ,羽海野千花,玉皇朝出版集团, ,郑盈盈,2004-8-4, , , ,蜂蜜與四葉草,9789628864560,"就读美术大学的竹本,真山,森田3人住在一个便宜公寓里的只铺着六块草席.外加厨房3块,没有洗澡的房间,虽然过着贫穷的日子,但对3人来说丝毫没有影响对生活的热爱. 就这样平凡生活当中的某天,3人通过花本老师的介绍.认识了他的侄女,像少女一样娇小可爱的插斑生久美.就像是明明中注定似的,竹本和森田似乎都对花本一见钟情. 但是两人的求爱表现恰恰是相反的,相对与无意中的简单易懂,但又有些苯拙的竹本来说.森田的那些极度难懂的爱情表现却经常让周遭为难.3人的爱情表现交错中,森田就不用说了,竹本甚至是久美连互相的心情也没察觉到,时间就这样流逝而去. 另一方面,真山强烈思念着建筑设计师理花.真山一心一意想用自己的真诚来希望换得理花的爱.但理化却因为他的执着而感到心情沉重.真山虽也注意到一心关心着自己的同年纪的山田的心情,却不能给她回报~~ 想要填补心灵空缺的真山,不能接受真山爱的理化,只是喜欢真山却留不住他的山田. 从此生活就围绕着以两个各自感到痛苦的三角关系为中心,各自的心情,各自的烦恼,而展开一串串虽然有些悲伤却又有趣的单恋故事~~",
44,圈子圈套2,https://book.douban.com/subject/1853323/,7.9,7889, ,王强,长江文艺出版社, , ,2006-8,362,28.00,平装,圈子圈套,9787535433275,洪钧出任维西尔中国区总经理，他和俞威之间的较量又或明或暗地展开来，面对内部的纷争和商场上的尔虞我诈，他该如何出招……一波未平，一波又起，一股来自总部的人事变动的暗流汹汹向他袭来，他又将如何应对…… 俞威依旧在ICE呼风唤雨，锋芒毕露，然而当他发现新任研发中心的负责人竟然和洪钧有某种渊源时，他还能笑得起来吗？他将如何面对这一颗“定时炸弹”……,王强，在清华大学获得工科硕士学位后，出人意料地到联想集团做了一名最底层的销售员，然后先后在SSA中国公司、西门子中国有限公司、Siebel Systems和SAS Institute等多家知名外企工作。短短七年间，从国内企业的一名普通员工飙升到外企在华机构的的最高层，先后担任两家跨国软件巨头在中国区的总经理，堪称职场精英，有着令人称奇的丰富经历。 自2005年开始，王强将自己十数载的商海经历和职场体悟以小说的形式发表于网上，旋即引起哄动，为广大读者所热棒，开创了商界精英创作专业题材小说的先河。
45,认识电影,https://book.douban.com/subject/2326403/,8.9,18282,美,路易斯·贾内梯 / [瑞典,世界图书出版公司, ,焦雄屏,2007-11,484,68.00,平装,后浪电影学院,9787506287081,《认识电影》作为电影入门书中的经典之作，用深入浅出的笔触，告诉我们影视传播的手法，并逐项解析其复杂的语言系统与要素。问世几十年以来，此书始终是世界各地影视从业人员和主流专业院校的必备之选，更是电影爱好者不可或缺的手边书。 这本书从电影理论的典型视角出发，简明扼要地评论了电影艺术的方方面面。书中提及的影片包罗万象，组成了一道世界各地电影人的经验光谱，其中有我们熟悉的面孔如美国的斯蒂芬·斯皮尔伯格、英国的麦克·李、伊朗的阿巴斯以及中国的李安等。作者对欧美影片和导演了如指掌，尤其对美国影片和美国导演做了全面而详细的介绍。同时，作者也很关注第三世界国家电影，书中广泛涉及了伊斯兰电影、新亚洲电影以及非洲电影。作者以鞭辟入里的分析，新颖独到的见解和纷繁多样的视觉冲击，呈现给读者一个全新的电影世界。 全书围绕电影制作的核心要素组织架构，其中穿插以数百幅精美图片和精辟的说明，再加上缀于各章后的延伸阅读和书末的重要词汇表，让读者在轻松的阅读过程中吸收到最专业的电影知识，从而真正“认识”电影。,"路易斯·贾内梯（Louis Giannetti），美国著名电影理论家和影评人，俄亥俄州凯斯西储大学荣誉教授。贾内梯毕业于爱荷华大学及波士顿大学，20世纪60年代晚期开始讲授18世纪英语文学，后转入电影研究。他的作品雅俗共赏，内容涵盖政论、文学和戏剧等多方面，代表作有《美国电影大师》《闪回：电影简史》《戈达尔及其他：电影形式论文集》等。 英格玛·伯格曼（1918-2007），瑞典电影导演。代表作有《第七封印》《芬尼与亚历山大》《处女泉》等。 黑泽明（1910-1998），日本电影导演。代表作有《罗生门》《乱》《七武士》等。 焦雄屏，著名电影学者，华语世界最有影响力的电影人之一，现任台湾电影金马奖主席，“电影馆”系列丛书主编，著有《法国电影新浪潮》等四十余册文集。1975年毕业于台湾政治大学新闻系，1981年获得美国德州大学奥斯汀分校电影硕士学位,后就读于美国加州大学洛杉矶分校电影博士班。现主持台湾电影中心，并任教于台北艺术大学电影创作研究所。焦雄屏是台湾新电影的重要评论者和推动人，同时作为担任世界各大电影节评委次数最多的华人，她一直致力于将中国优秀的导演及电影推向世界。近年来多次与大陆和港台众多重要导演合作，监制了蔡明亮的《洞》、王小帅的《十七岁的单车》以及许鞍华的《姨妈的后现代生活》等一批优秀电影。"
46,一个人的电影,https://book.douban.com/subject/3239824/,7.4,5034, ,贾樟柯 / 格非,中信出版社, , ,2008-10,332,26.00,平装, ,9787508612713,这本书是著名导演、著名作家对电影的情感和感觉记录。 张艺谋、贾樟柯、田壮壮等内地导演，台湾电影教母焦雄屏，作家格非、王朔、李陀，毛尖，在书中讲述他们各自的影像生活、那些在他们生命中留下痕迹的电影以及由此唤醒的已然流逝的青春流年。读者可从中窥见一个时代隐约的背影。这是十年来《收获》杂志的经典专栏《一个人的电影》首次结集出版。,
47,瞬间空白,https://book.douban.com/subject/1087145/,7.6,4482, ,安妮宝贝（庆山）,知识出版社, , ,2001-1,356,20.60,平装, ,9787501527878,收入《空城》、《爱情理想》、《英俊男人》、《永远有多远》、《居住在深海的男人》、《漂亮女孩》、《一个游戏》等35篇作品。,
48,你们 我们 他们,https://book.douban.com/subject/1026411/,8.2,8108, ,幾米,辽宁教育出版社, , ,2003-8,119,25.00,平装,幾米作品精选集,9787538267068,《你们我们他们》这本书，对于爱情的态度，却是质疑居多，虽然书中人物双双对对，但是幾米在复数的对称中却安排了矛盾，于是抒情的幾米不见了，小小甜蜜的爱情只是穿插点缀；辛辣讽刺的文字，一针见血的论调，恋人朝天喷火的画面，情侣相对却不相望的窘境，让人心生警惕，这是一本掺杂了人生百味的爱情图文书。,幾米，1998年开始个人的绘本创作。1999年以《向左走·向右走》、《听幾米唱歌》和《月亮忘记了》三部作品，展现惊人的创作力和多变的叙事风格。2000年《我的心中每天开出一朵花》风格清新真挚。此后作品的形式更自由多变。2001年创作《地下铁》、《照相本子》、《1、2、3、木头人》。2002年创作《我只能为你画一张小卡片》、《布瓜的世界》。2003年创作《幸运儿》。幾米的创作热情与强烈的创意，让作品的图像空间饶富诗意，深情而迷人，文字节奏简约而自成风格，并迭有新作，令人惊喜连连。作品广受好评，深受读者喜爱，风靡两岸，美、法、德、希腊、韩、日等国皆有译本。
49,圈里圈外,https://book.douban.com/subject/1060779/,7.4,6317, ,庄羽,中国文联出版社, , ,2004-01,302,18.00,平装, ,9787505942592,2003年11月，以《幻城》一书一举成名的郭敬明以30万册的首印数出版新作《梦里花落知多少》，书出版后疯 卖，没多久销售突破50万册，就在郭敬明掀起新一轮热潮时，在《东方周刊》供职的女作家庄羽站出来指称：《梦里花落知多少》有超过7处情节与她的作品《圈里圈外》雷同，有些语言和人物性格完全模仿《圈里圈外》。孰是孰非，并不重要，对读者来说，这文字才是最重要的。,庄羽，七十年代生人，当过记者，做过编剧，出版作品涉及小说和散文，近期作品作品包括：小说《半张脸》 、《愿赌服输》、《圈里圈外》，剧本《愿赌服输》，曾在海外留学两年，现回国就职于�望东方周刊。
50,在细雨中呼喊,https://book.douban.com/subject/1009393/,8.4,12780, ,余华,上海文艺出版社, , ,2004-01,295,18.00,平装,余华作品系列,9787532125937,余华是获外国文学奖最多的一位中国当代作家。最近，余华的长篇小说《许三观卖血记》荣获美国巴恩斯－诺贝尔新发现图书奖，他还以另一部长篇小说《在细雨中呼喊》被法国文化交流部授予文学和艺术骑士勋章。 上海文艺出版社最近与余华合作，全新推出“余华作品系列”。作品系列共12册，完整收录了余华现有的作品，包括长篇、中篇和短篇小说以及随笔集，是目前余华唯一的一部作品总集<br>余华，浙江海盐人，海盐这个地方，是杭,余华，1960年4月3日生，浙江海盐人。在文革中读完小学和中学，此后从事过五年牙医。1983年开始写作，至今已出版长篇小说3卷、中短篇小说集6卷、随笔集3卷。其中《活着》和《许三观卖血记》同时入选百位批评家和文学编辑评选的“九十年代最具有影响的十部作品”。其作品被翻译成英文、法文、德文、俄文、意大利文、荷兰文、挪威文、韩文和日文等在国外出版。曾获意大利格林扎纳・卡佛文学奖（1998年），澳大利亚悬念句子文学奖（2002年）。
