,url,电影名称,别名,全部名称,电影评分,评分人数,导演,编剧,主演,上映年份,首映日期,国家,语言,片长raw,片长,季数,集数,单集片长raw,单集片长,类型,剧情简介
69,https://movie.douban.com/subject/3670447/,大内密探灵灵狗 大內密探靈靈狗,On His Majesty's Secret Service,大内密探灵灵狗 大內密探靈靈狗 / On His Majesty's Secret Service,5.2,153757,王晶,王晶,古天乐 / 徐熙媛 / 佟大为 / 吴君如 / 宋佳 / 刘洋 / 樊少皇 / 林子聪 / 刘仪伟 / 罗家英,2009,2009-07-30(中国大陆),中国香港 / 中国大陆 / 中国台湾,粤语 / 汉语普通话,98分钟,98,,,,,喜剧 / 动作 / 武侠 / 古装,庄严的皇宫内，十二位以属相命名的大内密探肩负着贴身保护皇上的重任，其中高天九外号“灵灵狗”（古天乐 饰）是一位满脑子充满奇想秒招的发明家。他靠各种“法宝”在保护皇上的过程中屡建奇功，但对于自己风情万种却功艺高强的未婚妻梅希望（大S 饰）的一片痴心，“灵灵狗”的反应却表现的相当木讷。为了让这“灵灵狗”这个木瓜开窍，梅希望想出了一个试探“灵灵狗”的办法。 深宫之类忠奸难辨，暗藏杀机。围绕公主选附马一事，各方面的力量都暗自勾结，企图谋权篡位并消灭以“灵灵狗”为首的大内密探，皇上安危遭受威胁，十二密探面临前所未有的挑战。
70,https://movie.douban.com/subject/1781126/,十二宫 Zodiac,索命黄道带(台) / 杀谜藏(港) / 杀人十二星座 / 杀人十二宫 / 十二宫杀手,十二宫 Zodiac / 索命黄道带(台) / 杀谜藏(港) / 杀人十二星座 / 杀人十二宫 / 十二宫杀手,7.5,199517,大卫·芬奇,詹姆斯·范德比尔特,杰克·吉伦哈尔 / 马克·鲁弗洛 / 安东尼·爱德华兹 / 小罗伯特·唐尼 / 布莱恩·考克斯 / 约翰·卡洛·林奇 / 里奇蒙德·阿奎特 / 鲍勃·斯蒂芬森 / 约翰·莱西 / 科洛·塞维尼 / 艾德·塞特拉基安 / 约翰·盖兹 / 约翰·特里 / 坎迪·克拉克 / 伊莱亚斯·科泰斯,2007,2007-03-02(美国),美国,英语,157 分钟,157,,,,,剧情 / 悬疑 / 惊悚 / 传记 / 犯罪,二十世纪70年代，旧金山出现了一个自称“十二宫”的杀人狂，杀人后，向媒体寄一封信，留下密码、线索，向警方挑衅，多次的阴差阳错使案件陷入僵局，警方渐渐束手无策。连环杀人案件也引起了《旧金山纪事报》的记者罗伯特（杰克•格兰恩哈尔 饰）和保罗（小罗伯特•唐尼 饰）的注意，他们在警察大卫（马克•普法洛 饰）的帮助下，开始调查这一系列的连环凶杀案件，在和“十二宫”杀手斗志斗勇的同时，他们个人的生活也面临了极大的挑战。
71,https://movie.douban.com/subject/1465037/,樱桃小丸子 ちびまる子ちゃん,Chibi Maruko-chan,樱桃小丸子 ちびまる子ちゃん / Chibi Maruko-chan,9.1,101308,芝山努 / 棚桥一德 / 楠叶宏三 / 佐藤龙雄 / 高木淳 / 高松信司 / 小林常夫 / 宫下新平 / 片渊须直 / 西田健一,樱桃子 / 芝山努 / 叶山阳一郎,鳕子 / 水谷优子 / 一龙斋贞友 / 屋良有作 / 富山敬 / 青野武 / 岛田敏 / 佐佐木优子 / 渡边菜生子 / 川田妙子 / 楢桥美纪 / 田野惠 / 浦和惠 / 马场澄江 / 本井英美 / 三浦雅子 / 大本真基子 / 折笠爱 / 山口胜平 / 沼田祐介 / 真山亚子 / 菊池正美 / 飞田展男 / 柏仓敦 / 松井摩味 / 大塚瑞惠 / 永泽菜教 / 津久井教生 / 茶风林 / 中友子 / 山本圭子 / 陶山章央 / 岩男润子 / 石村知子 / 野岛健儿 / 挂川裕彦,1990,1990-01-07(日本),日本,日语,,,,142,23分钟,23,剧情 / 喜剧 / 动画 / 家庭,小丸子是一名小学二年级的女生，她活泼、好动、懒惰、什么事情都拖到最后一刻才做、学习不认真、成绩平平、经常和姐姐斗气、爱幻想、做事没恒心……在小丸子身上我们或多或少都看到了自己童年的影子。如果小丸子算是一个“怪人”的话，那么她的周围可谓“怪人”多多，有点神经质的班长丸尾同学、权利欲极强的女副班长、经常和小丸子一起疯的爷爷，讨人厌的宾治同学等等，这群性格各异、精力充沛的小孩、大人们，每天都在演绎着生活的趣事，伴随着小丸子一天天长大。
72,https://movie.douban.com/subject/1819388/,波斯王子：时之刃 Prince of Persia: The Sands of Time,波斯王子：超时空之战(港) / 波斯王子：时之沙 / 波斯王子：时之砂,波斯王子：时之刃 Prince of Persia: The Sands of Time / 波斯王子：超时空之战(港) / 波斯王子：时之沙 / 波斯王子：时之砂,7.2,113714,迈克·内威尔,鲍兹·亚金 / 道格·米洛 / 卡洛·伯纳德 / 乔丹·麦其纳,杰克·吉伦哈尔 / 杰玛·阿特登 / 本·金斯利 / 阿尔弗雷德·莫里纳 / 史蒂夫·图森特 / 托比·凯贝尔 / 理查德·柯伊尔 / 罗纳德·皮卡普 / 瑞斯·里奇 / 吉斯利·厄恩·加达松 / Claudio Pacifico / Thomas DuPont / Dave Pope / Domonkos Pardanyi / Massimiliano Ubaldi / 弗拉基米尔·弗迪克 / 塞尔瓦·拉萨林根 / 达尔文·肖 / 罗汉·希瓦 / Stephen A. Pope / 法尔扎纳·杜阿·鄂雷恩 / Emmanuel Akintunde / Craig Braginsky / 若昂·科斯塔·梅内塞斯,2010,2010-05-28(美国),美国,英语,116分钟,116,,,,,动作 / 奇幻 / 冒险,本片根据育碧软件公司2003年的同名电子游戏改编。十五年前，孤儿达斯坦（杰克·吉伦哈尔 Jake Gyllenhaal 饰）在市集上因英勇好战被波斯国王收养入宫。十五年后，长大成人的达斯坦随两位哥哥和叔父（本·金斯利 Ben Kingsley 饰）出征，奇袭圣城阿拉姆特，并得到国王许婚，将阿拉姆特公主塔米娜（杰玛·阿特登Gemma Arterton 饰）许配与他。达斯坦无意中得到了塔米娜公主竭尽全力保护的“时之砂”匕首，却被诬陷毒害老国王，被迫逃亡。为了洗清罪名，同时确保伟大的波斯帝国不至于沦落他手，达斯坦胁迫塔米娜公主与他一同进入了臭名昭著的“奴隶谷”，破坏了阿马尔酋长（阿尔弗雷德·莫里纳 Alfred Molina 饰）的鸵鸟大赛。在老国王的葬礼上，达斯坦终于发现了幕后凶手，而塔米娜公主也终将有关“时之砂”的秘密据实以告……
73,https://movie.douban.com/subject/1470600/,鸟！鸟！鸟！ For the Birds,献给鸟儿们 / 鸟鸟鸟,鸟！鸟！鸟！ For the Birds / 献给鸟儿们 / 鸟鸟鸟,8.6,68579,拉夫·埃格尔斯顿,,拉夫·埃格尔斯顿,2000,2000-06-05(法国安锡国际动画电影节),美国,英语,3 分钟,3,,,,,动画 / 短片 / 家庭,一群性格尖酸的小鸟集聚在电线上，唧唧喳喳吵个不停。 不速之客大笨鸟的到来打破了他们的争吵，小鸟们突然团结起来，一致对外，对大笨鸟冷嘲热讽，甚至打算齐心合力把它排挤出去。可就在成功在即之时，意外发生了......
74,https://movie.douban.com/subject/1949812/,东京审判,远东国际大审判 / The Tokyo Trial,东京审判 / 远东国际大审判 / The Tokyo Trial,7.5,90949,高群书,唐灏 / 张思涛 / 张弛 / 胡坤,刘松仁 / 朱孝天 / 曾江 / 谢君豪 / 林熙蕾 / 英达 / 曾志伟,2006,2006-09-01(中国大陆),中国大陆,英语 / 日语 / 汉语普通话,111分钟,111,,,,,剧情 / 历史 / 战争 / 犯罪,1946年，远东国际军事法庭在东京审判日本战犯，当时法庭由11个国家的11名法官组成，受中国国民政府的委任，以梅汝璈（刘松仁 饰）为首的中国法官在3月20日飞抵东京。《大公报》记者肖南（朱孝天 饰）负责远东国际军事法庭的全程跟踪报道，战前相爱的恋人和田芳子（林熙蕾 饰）与他相 会。在宴会上，肖南目睹了梅汝璈的激动和欢欣，却预感到此行必定多艰难。 审判终于开庭了，中国代表团遭受到了种种困难和挫折，整个法庭不赞成死刑的人居然占多数。面对各国法官们的偏见与刁难，中国法官和检察官们与他们斗智斗勇，克服了对美国法律不了解的种种不利因素，在庭审辩论中取得了上风。最终法庭是否能将东条英机等臭名昭著的战犯送上绞刑架呢？
75,https://movie.douban.com/subject/1428577/,九色鹿,The Nine-Colored Deer / 鹿王本生,九色鹿 / The Nine-Colored Deer / 鹿王本生,8.9,93978,钱家骏 / 戴铁郎,潘絜兹,丁建华 / 杨成纯 / 程晓桦 / 于鼎,1981,1981,中国大陆,汉语普通话,25分钟,25,,,,,剧情 / 动画 / 短片 / 奇幻,在敦煌莫高窟，保存着古代无数不知姓氏艺术家的手绘珍品，本动画片所讲述的，是其中一个古老而优美的故事画赞。 看到波斯商人在荒无人烟的戈壁滩上迷路时，九色鹿为他们指点了方向，花喜鹊得知此事后，埋怨九色鹿做事草率，它担心手拿刀枪的波斯商人会把九色鹿的故事说出去。不久，九色鹿救下落水的弄蛇人，告诉他不要将看到自己的事情说出去，弄蛇人对天发誓会保守秘密。波斯商人拜见国王时，果然如花喜鹊所担心的，讲了他们在荒漠中的奇遇，王后听到，执意要用九色鹿的鹿皮做衣裳，其后，国王张贴布告，说捕到九色鹿者封官重赏。弄蛇人犹豫一番，见利忘义向国王高密，在遍地寻不着九色鹿的情况下他假装落水，九色鹿闻声赶来。
76,https://movie.douban.com/subject/4133988/,枪王之王,Triple Tap,枪王之王 / Triple Tap,6.7,142698,尔冬升,尔冬升 / 秦天南 / 刘浩良,古天乐 / 吴彦祖 / 李冰冰 / 蔡卓妍 / 杜汶泽 Chapman To / 方中信 / 连凯 / 林雪 / 王敏德,2010,2010-07-02(中国大陆),中国香港 / 中国大陆,粤语 / 汉语普通话,117分钟,117,,,,,动作 / 悬疑 / 惊悚,在IPSC实战射击赛中，警员庄子维（吴彦祖 饰）打破了赛会纪录，但新纪录很快被香港基金经理关友博（古天乐 饰）改写，后者夺魁。赛后，关友博巧遇蒙面歹徒打劫解款车，解款员被歹徒打死。此时，一个交通警（连凯 饰）路过，被歹徒打伤。为救人，关友博击毙了4名劫匪，并报警。另一歹徒落荒而逃，同时4亿美元债券遭抢。交警获救，护理他的是关有博的女友（蔡卓妍 饰）。因非法持枪伤人，关友博被拘。庄子维审问时发现对方超常冷静。面对检方控诉，关友博沉着应对，结果当庭获释。女上司（李冰冰 饰）接他回家，但他对她的殷勤并不领情。关友博的账户存在资金周转问题，他正想方设法拖延还款时间。庄子维在查案中毫无头绪，于是请教老枪王（方中信 饰），从对话中，他似乎嗅到了关键性的线索……
77,https://movie.douban.com/subject/1441238/,面纱 The Painted Veil,爱在遥远的附近(港) / 猜心(台),面纱 The Painted Veil / 爱在遥远的附近(港) / 猜心(台),8.3,173620,约翰·卡兰,罗恩·内斯万尼尔 / 威廉·萨默塞特·毛姆,爱德华·诺顿 / 娜奥米·沃茨 / 托比·琼斯 / 黛安娜·里格 / 黄秋生 / 列维·施瑞博尔 / 朱丽叶·霍兰德 / 艾伦·戴维 / 露西·弗勒 / 玛姬·斯蒂德 / 佐伊·特尔福德 / 夏雨 / 吕燕 / 冯瓅 / 玛丽-洛尔·德库洛 / 凯瑟琳·安 / 李滨 / 洛琳·劳伦斯 / 伊恩·伦威克 / 程思寒 / 亨利·赛洛,2006,2006-12-29(中国大陆) / 2006-12-20(洛杉矶首映) / 2007-01-19(美国),美国 / 中国大陆 / 加拿大,英语 / 汉语普通话 / 法语,125分钟,125,,,,,剧情 / 爱情,电影讲述了20年代一对年轻的英国夫妇来到中国乡村生活的故事，在这美丽却凶险的环境中，他们经历了在其英国家乡舒适生活中绝对无法想象和体验的情感波澜，并领悟到了爱与奉献的真谛。 故事以女主角吉蒂开篇，为了逃离20年代伦敦浮华却又空虚的社交圈，也为了防止自己变成一位老姑娘，吉蒂接受了沉默寡言的医生沃特·费恩的求婚。费恩在把吉蒂带到上海后，便迅速地投入到了他的细菌学研究中去。孤独的吉蒂和迷人的已婚男子查理·唐森发生了婚外情，当费恩发现时，他羞恨交加。为了报复，也为了重整自己的生活，费恩决定孤注一掷，带着吉蒂远走霍乱肆虐的偏远城镇。沃特从一尘不染的研究室走向了瘟疫流行的最前线，他慢慢地协助控制了当地的疫情。吉蒂则开始在一家由法国修女住持的修道院兼医院中做义工，并逐渐找回了生活的勇气和意义。沃特和吉蒂终于可以互相敞开心扉，但就在他们日渐亲密的同时，沃特染上了霍乱。沃特的生死决定了他们新近迸发出来的激情能否转化为永恒的爱情……
78,https://movie.douban.com/subject/1951318/,生日快乐,Happy Birthday,生日快乐 / Happy Birthday,7.1,60861,马楚成,张艾嘉 / 邓洁明 / 胡恩威,古天乐 / 刘若英 / 曾宝仪 / 吴嘉龙 / 吴耀汉 / 周俊伟 / 任贤齐 / 林雪 / 谭俊彦 / 工藤佑也 / 郭羡妮 / 李勤勤,2007,2007-01-16(中国大陆),中国香港,粤语 / 日语,107 分钟,107,,,,,爱情,若即若离的感情线，一个在防守，一个在等待。小米（刘若英饰）与小南（古天乐饰）是大学时候的同学。每年小米的生日，小南都会送上祝福，唱一首五音不全的歌给小米听。彼此相知相爱，可是小米因为童年的阴影始终无法正面她与小南之间的感情。 小米后来出国留学了，两人分隔两地但心里还是时时牵挂彼此。历年的生日，小米仍记得小南的祝福。 仿佛各自又有了不一样的生活，可是当年的记忆还在。最后小南告诉小米自己就要踏上婚姻的道路，小米伤心欲绝，要强的她此刻才剖白心声。就算他们仍然彼此相爱，可一切都已经无法回头……
79,https://movie.douban.com/subject/1756073/,我们俩,Wo men lia / You and Me,我们俩 / Wo men lia / You and Me,8.8,118151,马俪文,马俪文,宫哲 / 金雅琴 / 张淑芳 / 孙捷 / 罗忠学 / 强爽 / 刘正亮,2005,2006-04-10(中国香港电影节) / 2005-10(东京电影节),中国大陆,汉语普通话,88分钟,88,,,,,剧情,冬天，在某个四合院孤孤单单生活的老太（金雅琴）迎来一个来北京求学的外地女孩（宫哲）。女孩想租老太离学校很近的房子，但嫌老太要价太高，老太一脸爱住不住的表情坚决不降价，女孩无奈租了下来，两人开始磕磕绊绊争吵不休的主客生活。无论是安装电话、缴纳电话费，还是点电炉、借用电冰箱，女孩都觉得老太在处处算计她，心里十分委屈，老太看她，也是一百个不顺眼。 但日久生情，两人渐渐成了彼此的依靠。日子溜过春天、夏天，老太眼见女孩生活尤其恋爱中的喜怒哀乐，她晚年的孤独因为有女孩的陪伴冲淡了不少。秋天来临，女孩找到更好的住处，要离开老太，老太的精神一下子垮了下来。
80,https://movie.douban.com/subject/1304641/,红磨坊 Moulin Rouge!,梦断花都 / 情陷红磨坊(港),红磨坊 Moulin Rouge! / 梦断花都 / 情陷红磨坊(港),7.9,135230,巴兹·鲁赫曼,巴兹·鲁赫曼 / 克雷格·皮尔斯,妮可·基德曼 / 伊万·麦克格雷格 / 约翰·雷吉扎莫 / 吉姆·布劳德本特 / 理查德·劳斯伯格 / 加里·麦克唐纳德 / 亚采克·科曼 / 马修·惠德特 / 克里·沃克 / 卡罗琳·奥康纳 / 克里斯汀·阿努 / 娜塔莉·杰克逊·门多萨 / 劳拉·穆拉凯 / 大卫·文翰 / 凯莉·米洛,2001,2001-05-09(戛纳电影节) / 2001-05-24(澳大利亚) / 2001-06-01(美国),澳大利亚 / 美国,英语 / 法语 / 西班牙语,127 分钟,127,,,,,剧情 / 爱情 / 歌舞,红磨坊日日歌舞升平。夜总会，康康舞，这是个男人们花天酒地的享乐国度。然而，这儿的爱情，却无比纯净动人。 克里斯蒂安（伊万·麦戈雷格 Ewan McGregor 饰）是年轻的钢琴诗人，拥有美丽的歌喉。不顾父亲的反对，他来到了蒙马达小镇，这个“追求享乐”的地方。在这儿，他与莎婷（妮可·基德曼 Nicole Kidman 饰）意外 的相遇了。莎婷是红磨坊的当家花旦，被誉为“璀璨钻石”，受到很多人的青睐。然而她并不满足于卖唱的生活，想要借助公爵的力量，成为一名真正的巨星。克里斯蒂安的到来，打乱了她结识公爵的计划，却闯入了她的内心。英俊的少年用歌声，向莎婷诉说着“自由”、“美”、“真理”，并给她带来了她从未感受过的“爱”。莎婷找到了自己的梦想，渴望同她心爱的男人一同完成。然而，公爵的阻挠却让一切变得艰难。爱情，要怎样，与命运抗衡。
81,https://movie.douban.com/subject/3338821/,电焊工波力 BURN-E,Wall-E番外篇：电焊工 / 机器人总动员番外篇 / 瓦力番外篇 / 本力 / Burn·E,电焊工波力 BURN-E / Wall-E番外篇：电焊工 / 机器人总动员番外篇 / 瓦力番外篇 / 本力 / Burn·E,9.0,71670,安格斯·麦克莱恩,安格斯·麦克莱恩 / 安德鲁·斯坦顿 / 德雷克·汤普森,安格斯·麦克莱恩 / 泰莎·斯威格特 / 本·贝尔特 / 艾丽莎·奈特 / 杰夫·格尔林 / MacInTalk,2008,2008-11-18(美国),美国,英语,7分35秒,7,,,,,喜剧 / 科幻 / 动画 / 短片,作为一名纳米修复工程师（Basic Utility Repair Nano Engineer），电焊工波力（Burn E）（Angus MacLane 配音）的工作就是负责修补真理号太空船上的故障及损伤之处。这应该算是一份比较轻松的工作，但是随着瓦力的到来，一切变得令人难以忍受。起因是瓦力拨弄过的陨石碎片击毁了真理号的航线导航灯，波力得到主机命令后迅速前往修补。在这一过程中，瓦力和伊娃经常让波力分神，致使本来很简单的工作始终无法完成…… 本片为皮克斯动画长片《机器人瓦力》的配套短片，为波力配音的就是本片的主创设计师Angus MacLane。
82,https://movie.douban.com/subject/2028666/,换子疑云 Changeling,陌生的孩子(台) / 换命谎言(港) / 调包婴儿 / 换婴记 / 换亲子迷雾,换子疑云 Changeling / 陌生的孩子(台) / 换命谎言(港) / 调包婴儿 / 换婴记 / 换亲子迷雾,8.4,164358,克林特·伊斯特伍德,J·迈克尔·斯特拉辛斯基,安吉丽娜·朱莉 / 盖特林·格里菲斯 / 米歇尔·冈 / 约翰·马尔科维奇 / 科鲁姆·费奥瑞 / 杰弗里·多诺万 / 迈克尔·凯利,2008,2008-10-31(美国),美国,英语 / 葡萄牙语,141分钟,141,,,,,剧情 / 悬疑 / 惊悚,1928年美国洛杉矶，在电话局接线台工作的克莉斯汀•柯林斯（Angelina Jolie 安吉莉娜•朱丽 饰）独自抚养儿子沃特（Gattlin Griffith 加特林•格里菲斯 饰），母子的生活简单而幸福。然而她们的生活很快被打乱，某天当克莉斯汀下班后，发现儿子不见踪影。 在公众的舆论压力下，腐败的洛杉矶警方于5个月后找回沃特，但克莉斯汀发现这并非自己的亲生儿子。她三番五次要求警方澄清事实，帮其寻找真正的沃特，却一次次受到阻挠和指责，甚至以妨碍警方公务的罪名被送入精神病院。一向以揭露警方暴行为己任的牧师古斯塔夫•布里格拉伯（John Malkovich 约翰•马尔科维奇 饰），为了这个可怜女人的不幸遭遇奔走呼告。 另一方面，探员莱斯特（Michael Kelly 饰）在侦办一件偷渡案时，无意中发现了一起重大的连环儿童杀人案。少年沃特的失踪案似乎渐露眉目……
83,https://movie.douban.com/subject/3813779/,剑雨,剑雨江湖 / Reign of Assassins,剑雨 / 剑雨江湖 / Reign of Assassins,7.6,222564,苏照彬,苏照彬,杨紫琼 / 郑雨盛 / 王学圻 / 徐熙媛 / 余文乐 / 戴立忍 / 鲍起静 / 林熙蕾 / 郭晓东 / 江一燕 / 吴佩慈 / 李宗翰 / 金士杰 / 吴飞霞,2010,2010-09-28(中国大陆) / 2010-09-03(威尼斯电影节),中国大陆 / 中国香港 / 中国台湾,汉语普通话,120分钟,120,,,,,动作 / 爱情 / 武侠 / 古装,八百年前，天竺人罗摩来至中原弘法，其死后尸体被人盗取并分为两部分。传说拿到罗摩尸体的人能练成绝世武功，因此江湖上风波骤起。时有转轮王（王学圻 饰）操控的黑石杀手集团，专为朝廷杀害谋逆相左之人。转轮王率徒众夜袭藏匿半具达摩尸首的首辅张海端（李庆祥 饰）宅邸，但是他的手下细雨 （林熙蕾 饰）却带着残尸绝走江湖，致令转轮王发出江湖追杀令，引出一阵血雨腥风。 为避追杀，细雨易容，更名曾静（杨紫琼 饰），逃亡期间结识了木讷善良的江阿生（郑宇成 饰）。一段时间相处，二人渐渐萌生感情，更喜结连理。但是江湖恩怨，因蔓不断，怎可轻易了结……
84,https://movie.douban.com/subject/1291554/,歌剧魅影 The Phantom of the Opera,歌声魅影(港) / 安德鲁洛伊韦伯之歌剧魅影(台) / 歌剧院幽灵 / 剧院魅影,歌剧魅影 The Phantom of the Opera / 歌声魅影(港) / 安德鲁洛伊韦伯之歌剧魅影(台) / 歌剧院幽灵 / 剧院魅影,8.5,160372,乔·舒马赫,加斯顿·勒鲁 / 安德鲁·洛伊德·韦伯 / 乔·舒马赫,杰拉德·巴特勒 / 埃米·罗森 / 帕特里克·威尔森 / 米兰达·理查森 / 明妮·德里弗 / 塞伦·希德 / 西蒙·卡洛 / 维克多·麦奎尔 / 詹妮弗·艾莉森 / 穆雷·梅尔文 / 凯文·麦克纳利 / 詹姆斯·弗雷特 / 保罗·布洛克 / 莱明·卡莱姆罗,2004,2004-12-10(英国) / 2004-12-22(美国),英国 / 美国,英语 / 意大利语,143 分钟,143,,,,,剧情 / 爱情 / 惊悚 / 音乐,巴黎歌剧院合唱团的新人克莉斯汀（艾米•罗苏姆 Emmy Rossum 饰）最近进步神速，全因剧院内的一间古老房间内每晚都会传出一把优美的男声向她传授歌唱技巧。这个良师益友其实是一个人称“剧院魅影”（杰拉德•巴特勒 Gerard Butler 饰）的人，此人因样貌丑陋，自小便被父母抛弃，戴着面具隐居在剧院的地下室。“剧院魅影”内心其实深爱着克莉斯汀。 一次偶然的机会，克莉斯汀有幸担当一部歌剧的主角。凭借从“剧院魅影”那里学得的丰富的歌唱技巧，克莉斯汀一炮而红，并被年轻英俊的剧院赞助人拉乌尔（帕特里克•威尔逊 Patrick Wilson 饰）看上了。两个年轻人很快堕入了爱河。“剧院魅影”伤透了心，认为是拉乌尔抢走了克莉斯汀，准备上演一出爱情复仇的大戏……
85,https://movie.douban.com/subject/3777800/,月满轩尼诗 月滿軒尼詩,月满轩尼斯 / Crossing Hennessy,月满轩尼诗 月滿軒尼詩 / 月满轩尼斯 / Crossing Hennessy,6.7,87686,岸西,岸西,张学友 / 汤唯 / 鲍起静 / 李修贤 / 安志杰 / 张可颐 / 朱咪咪 / 郭锋 / 林威 / 卢冠廷,2010,2010-04-02(中国大陆) / 2010-03-21(中国香港电影节) / 2010-04-01(中国香港),中国香港,粤语 / 汉语普通话,105分钟,105,,,,,喜剧 / 爱情,香港湾仔，电器行老板娘（鲍起静 饰）丈夫早亡，她和妹妹共同抚养儿子阿来（张学友 饰）。但后者终日沉迷侦探小说，41岁依然单身，还常会跟想象中的亡父对话。在一场相亲宴上，阿来见到了洁具行售货员爱莲（汤唯 饰），起初有点尴尬，后来在茶餐厅，两人谈笑风生。不过，爱莲一直挂念狱中的古惑仔男友阿旭（安志杰 饰），所以对这门亲事只是敷衍。阿来同样接到了前女友（张可颐 饰）的邀请，出任男模，两人似乎重新擦出了火花。虽然阿来和爱莲各怀心事，但两人却在轩尼诗道再度重逢。与此同时，老板娘却因为报税之事跟老相好（李修贤 饰）闹了别扭，而且，一直蒙在鼓里的她还目睹了阿旭与爱莲牵手逛街。经受不住打击的她彻底崩溃、住进了医院。此后，阿来跟前女友，爱莲跟阿旭的感情却发生了变化……
86,https://movie.douban.com/subject/1294990/,勇敢者的游戏 Jumanji,逃出魔幻纪(港) / 野蛮游戏(台) / 勇敢人的游戏 / 逃出侏曼纪 / 勇敢者游戏,勇敢者的游戏 Jumanji / 逃出魔幻纪(港) / 野蛮游戏(台) / 勇敢人的游戏 / 逃出侏曼纪 / 勇敢者游戏,8.2,132391,乔·庄斯顿,乔纳森·汉斯雷 / 格雷格·泰勒 / 吉姆·斯特兰 / 克里斯·范·奥斯伯格,罗宾·威廉姆斯 / 乔纳森·海德 / 克斯汀·邓斯特 / 布莱德利·皮尔斯 / 派翠西娅·克拉克森 / 邦尼·亨特,1995,1995-12-15(美国),美国,英语,104分钟,104,,,,,动作 / 奇幻 / 冒险,“尤曼吉”是一种类似于大富翁的棋类游戏，然而，和大富翁不同的是，“尤曼吉”的棋子能自动移动，当你走到其中一格时，这格描述的东西就会真实出现在你面前，而且游戏一经开始便不能结束，只有游戏结束才一切复原！ 12岁的阿伦（罗宾•威廉斯 Robin Williams 饰）和好友萨拉（邦尼•亨特 Bonnie Hunt 饰）才刚一开始玩“尤曼吉”，就被棋盘里面飞出来的蝙蝠吓得魂不附体，冲进了“尤曼吉”的神奇世界里，没能继续玩下去，以致两人就这样困在了另一个世界里。 26年后，阿伦当年住的房子又搬进了两个小客人――朱迪（克尔斯滕•邓斯特 Kirsten Dunst 饰）和皮特（布雷德利•皮尔斯 Bradley Pierce 饰）姐弟两。他们在“尤吉曼”的战鼓声指引下找到了当年阿伦还没玩完的“尤吉曼”。在熟悉规则后，他们继续了当年阿伦还没结束的游戏……
