,url,电影名称,别名,全部名称,电影评分,评分人数,导演,编剧,主演,上映年份,首映日期,国家,语言,片长raw,片长,季数,集数,单集片长raw,单集片长,类型,剧情简介
66,https://movie.douban.com/subject/1307748/,神秘河 Mystic River,悬河杀机(港) / 神秘河流(台) / 神秘之河 / 杀人约会 / 神秘悬河,神秘河 Mystic River / 悬河杀机(港) / 神秘河流(台) / 神秘之河 / 杀人约会 / 神秘悬河,7.9,73518,克林特·伊斯特伍德,布莱恩·海尔格兰德 / 丹尼斯·勒翰,西恩·潘 / 蒂姆·罗宾斯 / 凯文·贝肯 / 劳伦斯·菲什伯恩 / 马西娅·盖伊·哈登 / 劳拉·琳妮 / 埃米·罗森,2003,2003-05-23(戛纳电影节) / 2003-10-15(美国),美国 / 澳大利亚,英语,138分钟,138,,,,,剧情 / 悬疑 / 惊悚 / 犯罪,吉米（西恩•潘 Sean Penn 饰）、戴夫（蒂姆•罗宾斯 Tim Robbins 饰）和西恩（凯文•贝肯 Kevin Bacon 饰）是儿时最要好的玩伴。戴夫10岁那年的一桩事件却改变了单纯美好的童年和友谊。尚且年幼的戴夫被歹徒绑架，对他施以性虐待，这个羞辱的经历从此改变了戴夫的人生。他变得与别人越来越疏离，三人的友谊在慢慢消融。 三人各奔东西，却因为吉米的女儿遭杀害而重新有了联系。因为负责这个案件的，碰巧是西恩，此时他已是一名警探，面对好友女儿的被害，心急要找出真凶，却意外发现所有证据的矛头都指向了那个曾经亲密无间的伙伴——戴夫。关系变得剑拔弩张，而过去的友谊，如今的对立，都在拉扯着每个当事人的心。
67,https://movie.douban.com/subject/1302061/,"德州巴黎 Paris, Texas",巴黎，德州(台) / 德克萨斯州的巴黎 / 德克萨斯，巴黎,"德州巴黎 Paris, Texas / 巴黎，德州(台) / 德克萨斯州的巴黎 / 德克萨斯，巴黎",8.5,67076,维姆·文德斯,L.M.基特·卡森 / 山姆·夏普德,哈利·戴恩·斯坦通 / 萨姆·贝瑞 / 伯恩哈德·维基 / 迪恩·斯托克维尔 / 奥萝尔·克莱芒 / 亨特·卡森 / 维娃 / 索科洛·瓦尔迪兹 / 娜塔莎·金斯基 / 汤姆·法雷尔 / 约翰·劳瑞,1984,1984-05-14(戛纳电影节) / 1984-09-14(法国),西德 / 法国 / 英国 / 美国,英语 / 西班牙语,145分钟,145,,,,,剧情,查韦斯（哈利·戴恩·斯坦通 Harry Dean Stanton 饰）迷失在德州荒无人烟的沙漠中，因为身体虚弱而昏迷。医院联系了他的弟弟沃特（迪恩·斯托克维尔 Dean Stockwell 饰）来接他。出院的查韦斯一直沉默，直到看见“巴黎，德州”的牌子，才终于开口。 回 到洛杉矶弟弟家，查韦斯见到了儿子——亨特（亨特·卡森 Hunter Carson 饰演），弟弟弟妹其实是养父养母。但是亨特对突如其来的父亲并不接受。后来，查韦斯用很特别的方式收复了孩子的心。通过交流，查韦斯了解到孩子的生母——简（娜塔莎·金斯基 Nastassja Kinski 饰）的下落。于是，父子踏上了一条寻母之路…… 本片获第37届戛纳电影节最佳影片金棕榈大奖。
68,https://movie.douban.com/subject/1325399/,狼的诱惑 늑대의 유혹,爱上蛋白质女孩(台) / True Romance / Romance of Their Own,狼的诱惑 늑대의 유혹 / 爱上蛋白质女孩(台) / True Romance / Romance of Their Own,6.9,52329,金泰均,Gwiyeoni,姜栋元 / 赵汉善 / 李清娥 / 郑多慧 / 金应洙 / 洪智英,2004,2004-07-23(韩国),韩国,韩语,113分钟,113,,,,,剧情 / 动作 / 爱情,苦命女孩郑汉景（李青儿 饰）父母早年离异，一起生活的父亲突然病故，所以她孤身一人来到汉城投靠妈妈。不想，她却在地铁站里目睹了两股校园帮派的火拚，为首的两个帅哥竟然先后走入了她的生活中。其中，霸道蛮横的班海沅（赵瀚宣 饰）是个花花公子，但是因为汉景的出现使其性格发生了转变。温文尔雅的郑泰成（姜东元 饰）是个懂得体贴的谦谦君子，对汉景关怀备至。 两个帅哥为了争夺女孩展开了一场拉锯战，不但醋意十足，而且大打出手。一时间，女孩成为学校间的风云人物，遭到了不少异性的排挤和非议。单纯的汉景经常会产生幻想和错觉，然而当两个追求者的身份曝光后，女孩才发现了现实竟然如此巧合，又如此残酷……
69,https://movie.douban.com/subject/1470614/,小杰克的攻击 Jack-Jack Attack,,小杰克的攻击 Jack-Jack Attack,8.1,27294,布拉德·伯德,布拉德·伯德,Bret 'Brook' Parker / 巴德·乐凯 / Eli Fucile / 杰森·李,2005,2005-03-15(美国),美国,英语,5 分钟,5,,,,,动画 / 短片 / 家庭 / 冒险,小杰克是谁呢？是超人的儿子，而他的保姆凯莉可不知道。 就在凯莉拍着胸脯向杰克妈妈保证万事无忧时，奇怪的事一件接一件的发生了。这个婴儿杰克简直是捣蛋无厘头，凯莉被整惨了。最后婴儿杰克“爆炸”了。 凯莉被带到安全局接受审查，对她来说忘掉这场噩梦再好不过，很快她就如愿以偿了。
70,https://movie.douban.com/subject/1394324/,东方不败之风云再起 東方不敗之風雲再起,笑傲江湖之东方不败风云再起 / 东方不败：再起风云 / 东方不败重撼江湖 / 笑傲江湖3 / The East Is Red / Swordsman 3,东方不败之风云再起 東方不敗之風雲再起 / 笑傲江湖之东方不败风云再起 / 东方不败：再起风云 / 东方不败重撼江湖 / 笑傲江湖3 / The East Is Red / Swordsman 3,7.4,105937,李惠民 / 程小东,司徒慧焯 / 张炭 / 徐克,林青霞 / 王祖贤 / 王静莹 / 于荣光 / 刘洵 / 高雄 / 李家鼎 / 苑琼丹 / 任世官,1993,1993-01-21(中国香港),中国香港,粤语,98分钟,98,,,,,动作 / 爱情 / 武侠 / 古装,水师提督顾长风（于荣光饰）奉朝廷之命带领西班牙舰队探访黑木崖，过程中西班牙领队欲打开东方不败的棺木与视东方不败为偶像的顾长风发生争执。正在此时黑木崖上忽然现身一怪人（刘洵饰），可以以掌接西班牙火枪子弹。顾长风被怪人所救，却身受内伤，坚信其便是东方不败，坚持要一见其真面目 ，虽死无憾。怪人一偿所愿，让其看自己的庐山真面目，正是当年风采依旧的东方不败（林青霞饰）。顾长风告诉东方不败江湖上有很多人正在冒充他的名号为非作歹，东方不败于是决定留其性命，让他看着自己重出江湖。与此同时，东方不败旧时爱妾雪千寻（王祖贤饰）正率领着一群苗人打着东方不败的旗号与日本倭寇就海域问题谈判，雪千寻痴心不改，重组神教只是为了等待爱人归来......
71,https://movie.douban.com/subject/1474405/,难以忽视的真相 An Inconvenient Truth,绝望真相(港) / 不愿面对的真相(台) / 麻烦的真相,难以忽视的真相 An Inconvenient Truth / 绝望真相(港) / 不愿面对的真相(台) / 麻烦的真相,8.6,29417,戴维斯·古根海姆,阿尔·戈尔,阿尔·戈尔,2006,2006-01-24(圣丹斯电影节) / 2006-06-30(美国),美国,英语,96分钟,96,,,,,纪录片,他是几乎成为美国总统的人——阿尔·戈尔。很难说他成为总统会给世界带来怎样的改变，但是现在，他就在改变世界的路上。 本片记录了戈尔作为一个环保专家，一个世界公民，为了环保世界进行的种种努力。他精彩的演说，议会上咄咄逼人的质询，对于环保议程的推进努力，还有在这一切的背后，他的内心世界。
72,https://movie.douban.com/subject/3011049/,姐姐的守护者 My Sister's Keeper,姊姊的守护者 / 我姐姐的守护者,姐姐的守护者 My Sister's Keeper / 姊姊的守护者 / 我姐姐的守护者,8.2,59503,尼克·卡萨维蒂,杰里米·莱文 / 尼克·卡萨维蒂 / 朱迪·皮考特,阿比盖尔·布雷斯林 / 苏菲亚·威希涅瓦 / 卡梅隆·迪亚兹 / 希瑟·沃奎斯特 / 杰森·帕特里克 / 埃文·埃林森 / 亚历克·鲍德温 / 妮可·玛丽·伦茨 / Olivia Hancock / 艾米丽·丹斯切尔 / 马科斯·A.费拉斯 / 马修·巴里 / 马克·约翰逊 / 大卫·桑顿 / 伊丽莎白·戴利 / 里科·西莫尼尼 / Brennan Bailey / 琼·库萨克 / 瑞克·所罗门 / 咪咪·弗莱彻 / 林·沙烨 / 托马斯·戴克 / 艾莉雅·英格丽许 / 周英华 / 唐·阿伯纳西 / 查兰·安德烈亚斯 / 汤米·格里茨 / 赖恩·普雷姆斯伯格 / 卡莱蒂·威廉姆斯,2009,2009-06-26(加拿大),美国,英语,109 分钟,109,,,,,剧情 / 家庭,为了让罹患血癌的凯特（苏菲亚·威希涅瓦 Sofia Vassilieva 饰）能够活下去，父母通过基因技术“制造”了与凯特的基因完美配型的小女儿——安娜（阿比吉尔·布莱斯林 Abigail Breslin 饰）。安娜感觉自己只是姐姐凯特的“药罐子”，11年来，凡是在凯特有需要的时候，无论是脐带血还是白血球、肝细胞、骨髓，她都得源源不断的向凯特提供。然而，即使有孤注一掷的妈妈（卡梅隆·迪亚茨 Cameron Diaz 饰）、无可奈何的爸爸，以及身边所有人的爱，凯特的情况还是越来越糟，肾功能的衰竭必须要年仅11岁的安娜捐献出自己的一个肾。这一次，安娜选择了拒绝，并且寻找到律师坎贝尔把母亲告上法庭，她要捍卫自己的身体。然而，法庭上哥哥杰西却吐露了另一番真相…… 本片根据美国当代畅销书女王朱迪·皮考特（Jodi Picoult）的同名小说改编。
73,https://movie.douban.com/subject/1295292/,哥斯拉 Godzilla,酷斯拉(台) / 怪兽哥斯拉,哥斯拉 Godzilla / 酷斯拉(台) / 怪兽哥斯拉,7.2,81557,罗兰·艾默里奇,迪安·德夫林 / 罗兰·艾默里奇,马修·布罗德里克 / 让·雷诺 / 玛丽亚·皮提罗 / 汉克·阿扎利亚 / 凯文·杜恩,1998,1998-05-20,美国 / 日本,英语 / 法语 / 日语 / 俄语 / 西班牙语,139 分钟,139,,,,,动作 / 科幻 / 冒险 / 灾难,这天，美国纽约附近出现了一些异常现象：太平洋上的海浪速度超乎寻常地惊人、巴哈马巨大的原始森林里竟然出现了一个类似恐龙脚印的巨大痕迹、动物们都惊慌失措，仿佛一股巨大的力量正向纽约席卷而来。 原来，世界上频繁的核试验引起的核辐射导致了气候异常和最终导致岛上蜥蜴变异。现在，它正以越来越快的步伐向纽约逼近。这下，所有的人都慌了神，美国全国的所有力量都联合了起来，目的只有一个，就是在它踏入纽约前将它干掉！
74,https://movie.douban.com/subject/2301701/,人兽杂交 Splice,人工进化(台) / 接种(港) / 颤栗异种 / 人兽变种,人兽杂交 Splice / 人工进化(台) / 接种(港) / 颤栗异种 / 人兽变种,5.6,68672,文森佐·纳塔利,文森佐·纳塔利 / Antoinette Terry Bryant / 道格·泰勒,阿德里安·布罗迪 / 莎拉·波利 / 德尔菲娜·尚内亚克 / Brandon McGibbon / Simona Maicanescu / 大卫·休莱特 / Abigail Chu,2009,2009-10-06(希格斯国际奇幻恐怖电影节) / 2010-06-04(加拿大),加拿大 / 法国 / 美国,英语,104 分钟,104,,,,,剧情 / 科幻 / 惊悚,在大公司纽斯特德的支持下，生物科学家克里夫·尼科利（阿德里安·布洛迪 Adrien Brody 饰）和女友艾尔莎·卡斯特（萨拉·波莉 Sarah Polley 饰）进行基因重组的实验，并取得初步进展。然而由于资金和公众舆论等原因，纽斯特德高层决定中断对他们现有研究的支持。克里夫和艾尔莎不愿半途而废，于是偷偷展开实验。他们对基因进行优化重组，并混入了艾尔沙的一部分基因，终于孕育出一个相貌奇特的雌性怪物。 秉着科学家的道德和良知，克里夫执意要杀死怪物，而艾尔莎则全力保护，视若己出，并将其命名为卓伦。卓伦以飞快的速度成长，最终变成一位拥有独特美感的女孩（Delphine Chanéac 饰）。在这一过程中，克里夫和艾尔莎越陷越深……
75,https://movie.douban.com/subject/1296717/,夺宝奇兵 Raiders of the Lost Ark,法柜奇兵 / 夺宝奇兵：法柜奇兵 / 印地安纳・琼斯之夺宝奇兵 / Indiana Jones and the Raiders of the Lost Ark,夺宝奇兵 Raiders of the Lost Ark / 法柜奇兵 / 夺宝奇兵：法柜奇兵 / 印地安纳・琼斯之夺宝奇兵 / Indiana Jones and the Raiders of the Lost Ark,7.9,100207,史蒂文·斯皮尔伯格,劳伦斯·卡斯丹 / 乔治·卢卡斯 / 菲利普·考夫曼,哈里森·福特 / 凯伦·阿兰 / 保罗·弗里曼 / 罗纳德·莱西 / 约翰·瑞斯-戴维斯 / 丹霍姆·艾略特 / 阿尔弗雷德·莫里纳 / 沃尔夫·卡赫勒 / 安东尼·希金斯 / 维克·塔布安 / 唐·费洛斯 / 威廉·胡特金斯,1981,1981-06-12(美国),美国,英语 / 德语 / 希伯来语 / 西班牙语 / 阿拉伯语 / 尼泊尔语,115分钟,115,,,,,动作 / 冒险,二战期间，希特勒在世界各地召集考古学家寻找“失落的约柜”——圣经中引导希伯来人与上帝交流的圣物，希特勒欲借其来护佑纳粹的战争。 为了使希特勒的计划破灭，印第安纳琼斯博士（Harrison Ford饰）奔赴尼泊尔，一边奋力挖掘蛛丝马迹，一边还要与无孔不入的纳粹分子周旋。凭 借着过人的智慧和异于常人的胆量及大无畏的勇气，琼斯终于在埃及找到了指示约柜位置的太阳手杖，继而发现了约柜。 就在大功告成之际，纳粹军却侵吞了胜利果实，还将琼斯等人留在了蛇穴里！但是无往不胜的琼斯总是有办法死里逃生，并狠狠地还以颜色！
76,https://movie.douban.com/subject/1304643/,侏罗纪公园3 Jurassic Park III,Jurassic Park 3,侏罗纪公园3 Jurassic Park III / Jurassic Park 3,7.4,122559,乔·庄斯顿,彼得·布奇曼 / 亚历山大·佩恩 / 迈克尔·克莱顿 / 吉姆·泰勒,山姆·尼尔 / 威廉姆·H·梅西 / 蒂娅·里欧妮 / 亚历桑德罗·尼沃拉 / 特拉沃·摩根 / 迈克尔·杰特 / 约翰·迪尔 / 劳拉·邓恩 / 泰勒·尼科斯 / 马克·哈雷利克 / 胡里奥·奥斯卡·门乔索 / 布莱克·迈克尔·布莱恩 / 萨拉·丹尼尔·马迪森 / 琳达·朴 / 布鲁斯·A·扬,2001,2002-01-23(中国大陆) / 2001-07-18(美国),美国,英语,92 分钟,92,,,,,动作 / 科幻 / 惊悚 / 冒险,继索纳岛恐龙逃往事件过去已有八年，艾伦•格兰特博士（山姆•尼尔 Sam Neill 饰）无论如何也不愿再返回那个鬼地方。虽然发下重誓，但现状不得不让他收回誓言。他的一项史前动物研究陷入资金紧张的窘境。而这时，富有的商人保罗•科比（William H. Macy 饰）及其夫人阿曼达（Téa Leoni 饰）找到艾伦，邀请他作为向导带他们乘飞机前往索纳岛观光。一方面酬劳颇丰，一方面又得知不用着陆小岛，好了伤疤忘了疼的艾伦接受了他们的邀请。 然而事情却朝相反的方向发展，他们的飞机最终迫降小岛。至此他才得知，原来科比夫妇来此的目的竟是为了寻找失踪的儿子。与此同时他还发现，经过八年的自然进化，恐龙中最聪明的速龙竟然拥有了自己赖以交流的语言。这一次他的对手不仅凶恶，而且更为狡猾……
77,https://movie.douban.com/subject/2038365/,十三棵泡桐,刀子和刀子 / P·T·S·Z·X / Thirteen Princess Trees,十三棵泡桐 / 刀子和刀子 / P·T·S·Z·X / Thirteen Princess Trees,7.1,21916,吕乐,吕乐 / 刘颖,刘雅瑟 / 段博文 / 赵梦桥,2007,2007-03-23(中国大陆),中国大陆,汉语普通话 / 四川话,100分钟(东京电影节),100,,,,,剧情,
78,https://movie.douban.com/subject/1419581/,千杯不醉,"Drink, Drank, Drunk","千杯不醉 / Drink, Drank, Drunk",6.3,38898,尔冬升,尔冬升 / 方晴,杨千嬅 / 吴彦祖 / 方中信 / 胡静 / 钱嘉乐 / 官恩娜 / 连凯 / 戴梦梦 / 谷德昭 / 何华超 / 尹子维 / 岑宝儿 / 叶山豪 / 王合喜 / 樋口明日嘉 / 方平,2005,2005-08-18(中国香港),中国大陆 / 中国香港,汉语普通话 / 粤语,110 分钟,110,,,,,喜剧 / 爱情,小敏（杨千嬅饰）身为一个啤酒女郎，看尽了很多男人喝醉酒时的糗态，所以对男人甚有戒心，而黑社会老大九哥（方中信饰）对她情有独钟。厨师米高（吴彦祖饰）因为辛苦经营的餐厅结业，酒量甚浅的他醉倒在小敏的面前。两人互诉心声之余还互相鼓励，小敏为了减轻米高的负担，租下了米高经营不善的餐厅，两人一起经营咖啡屋。 米高受到的饮食界女王赵洁（胡静饰）的青睐，小敏知道是米高翻身的好机会，不敢阻止之余并决定把小餐厅结业。惟利是图的赵洁无法忍受，想回到小敏身边，本来千杯不醉的小敏，也在朋友的刻意计划下醉倒了，酒后吐真言，使米高惊讶。
79,https://movie.douban.com/subject/1293234/,第七封印 Det sjunde inseglet,The Seventh Seal,第七封印 Det sjunde inseglet / The Seventh Seal,8.5,54699,英格玛·伯格曼,英格玛·伯格曼,古纳尔·布约恩施特兰德 / 本特·埃切罗特 / 尼尔斯·波普 / 马克斯·冯·叙多夫 / 毕比·安德松 / 英加·吉尔 / 毛德·汉松 / 因加·朗格里 / 古内尔·林德布洛姆 / 贝蒂尔·安德贝里 / 安德斯·埃克 / 奥克·弗里德尔 / 古纳尔·奥尔松 / 埃里克·斯特兰德马克 / Siv Aleros / 斯滕·阿登斯坦 / 哈里·阿斯克隆德 / 本克特-奥克·本特松 / 凯瑟琳·贝里 / 莱娜·贝格曼 / 托尔·博龙 / 古德龙·布罗斯特 / 本特·伊尔贝里 / 拉尔斯·格兰贝里 / 贡勒格·哈格贝里 / 托尔·伊塞达尔 / 乌尔夫·约翰松 / 乌诺·拉松 / 伦纳特·利亚 / 拉尔斯·林德 / 戈东·勒韦纳德勒 / 莫娜·马姆 / 约瑟夫·诺尔曼 / 约斯塔·普吕塞柳斯 / 乔治斯卡斯特德 / 朗纳·瑟尔曼 / 伦纳特·托伦 / 尼尔斯·维滕,1957,1957-02-16(瑞典),瑞典,瑞典语 / 拉丁语,96分钟,96,,,,,剧情 / 奇幻,海滩边，巨浪滔天，英武的骑士布洛克（马克斯•冯•西多 Max von Sydow 饰）与黑衣死神（本特•埃切罗特 Bengt Ekerot 饰）摆下了一盘生死棋局。在下棋的过程中，骑士在回顾自己的人生，所见所闻暗合圣经的图景。十四世纪十字军东征后期，欧洲大陆瘟疫蔓延，民不聊生。布洛克曾遇到过马戏团的一对夫妻，丈夫笃信神明，无比虔诚，妻子则更加现实，唯命是从。他们的相濡以沫让幸福唾手可得。骑士在树林中邂逅了铁匠夫妇。铁匠非常粗鲁，他的妻子很是风骚，他们在树林里对着路人演出双簧，仿佛一对可笑的傀儡。最后，在经历过集体膜拜的祭奠仪式后，武士和他的朋友们再次遇到了死神，曾经的无助与恐惧，愤怒与怀疑，都化作了人生的诘问…… 本片获第10届戛纳电影节评委会大奖。
80,https://movie.douban.com/subject/1291564/,十分钟年华老去：大提琴篇 Ten Minutes Older: The Cello,十分大师－大提琴篇 / 十分钟后：提琴魅力 / 十分钟，年华老去（下）,十分钟年华老去：大提琴篇 Ten Minutes Older: The Cello / 十分大师－大提琴篇 / 十分钟后：提琴魅力 / 十分钟，年华老去（下）,8.2,15114,贝纳尔多·贝托鲁奇 / 克莱尔·德尼 / 迈克·菲吉斯 / 让-吕克·戈达尔 / 伊日·门泽尔 / 迈克尔·莱德福 / 沃尔克·施隆多夫 / 伊斯特凡·萨博,贝纳尔多·贝托鲁奇 / Augustinus / 克莱尔·德尼 / 迈克·菲吉斯 / E. Max Frye / 伊日·门泽尔 / 安娜-玛丽·米埃维尔 / 迈克尔·莱德福 / 伊斯特凡·萨博,瓦莱丽亚·布鲁尼·泰德斯基 / Amit Arroz / Mark Long / Alexandra Staden / 多米尼克·韦斯特 / 毕碧安娜·贝格 / 伊尔姆·赫尔曼 / 鲁道夫·霍辛斯基 / Jean-Luc Nancy / Ana Samardzija / 阿莱克斯·德斯卡 / 丹尼尔·克雷格,2002,2002-09-03(威尼斯电影节),英国 / 德国 / 法国,英语 / 匈牙利语 / 法语 / 德语,95 分钟(加拿大多伦多电影节),95,,,,,剧情 / 爱情 / 科幻 / 歌舞,大师们的命题作文，八位电影大师用各自的手法为我们解读了时间的含义。 贝纳多•贝托鲁奇在印度寓言中寻找答案，10分钟恋爱、结婚、生子，生活如水；迈克尔•菲吉斯将屏幕分成四块，让灵魂回望10分钟，把楼梯作为生死通道；伊利•曼佐的镜头下，老去的电影明星回顾黑白电影的片段，10分钟，已是好几个人生；......最后，让•吕克•戈达尔选择了10个“最后的几分钟”，试图告诉人们时间的真相，也让人思索，时间的几分钟会是什么样子？
81,https://movie.douban.com/subject/1302100/,尼罗河上的惨案 Death on the Nile,尼罗河上谋杀案 / 尼罗河谋杀案,尼罗河上的惨案 Death on the Nile / 尼罗河上谋杀案 / 尼罗河谋杀案,8.5,157759,约翰·吉勒明,安东尼·沙弗尼 / 阿加莎·克里斯蒂,彼得·乌斯蒂诺夫 / 简·伯金 / 洛伊丝·奇利斯 / 贝蒂·戴维斯 / 米娅·法罗 / 乔·芬奇 / 奥丽维娅·赫西 / I·S·乔哈尔 / 乔治·肯尼迪 / 安吉拉·兰斯伯瑞 / 西蒙·麦考金戴尔 / 大卫·尼文 / 玛吉·史密斯 / 杰克·瓦尔登 / 哈里·安德鲁斯,1978,1979-07(中国大陆) / 1978-09-29(美国),英国,英语 / 法语 / 德语,140分钟,140,,,,,剧情 / 悬疑 / 犯罪,痴情的神枪手 Jackie（Mia Farrow 饰）将贫穷的未婚夫 Simon Doyle（Simon MacCorkindale 饰）介绍到朋友 Linnet Ridgeway（Lois Chiles 饰）的庄园工作。谁知不久后 Simon 与 Linnet 结了婚，两人还如胶似漆地去埃及度蜜月。愤怒的 Jackie 跟到埃及，时时骚扰纠缠。在尼罗河游船上，Linnet 发现除了 Jackie 之外，船上很多游客都不怀好意。上岸参观卡纳克神庙时，一块巨石从高高的柱子上掉落，下面的 Simon 与 Linnet 差点丧命。可是，针对 Linnet 的谋杀并未停止。Linnet 躲过了一劫，却没躲过第二劫。除了 Linnet 惨死床上，Linnet 的女仆 Louise（Jane Birkin 饰）、声称目击到凶手的 Salome Otterbourne 夫人（Angela Lansbury 饰）都被灭口。经过调查，侦探 Hercule Poirot（Peter Ustinov 饰）发现，除了 Jackie 和 Simon，几乎每个游客都有充分的作案动机和时间。 那么，凶手究竟是谁？他是如何实施犯罪的？而之前推下巨石的又是谁？
82,https://movie.douban.com/subject/1461985/,闪闪的红星,Sparking Red Star,闪闪的红星 / Sparking Red Star,7.6,28861,李俊 / 李昂,王愿坚 / 陆柱国 / 李心田(原著),祝新运 / 刘江 / 刘继忠 / 高保成 / 薄贯君 / 李雪红 / 赵汝平,1974,1974-10-01(中国大陆),中国大陆,汉语普通话,100分钟,100,,,,,剧情 / 儿童 / 战争,故事发生在红军长征离开后的江西苏区。少年潘冬子（祝新运 饰）的父亲响应号召，参加红军抗击敌军去了，只剩下母亲与东子相依为命。母亲也是抗敌的积极分子，从小耳濡目染的冬子虽然只有11岁，也立下了决心长大参加红军对抗日军。 一天，反动地主胡汗三前来捉拿东子的母亲，眼看形势危急 ，冬子妈决定留下来掩护其他群众撤退。在连扔两枚手榴弹炸死多名敌人后，冬子妈亦英勇就义。目睹了妈妈被敌人杀害的惨况，冬子决心用自己的力量为母亲报仇。 冬子开始用自己的机智与勇敢与敌人周旋，暗中帮当地的游击队送盐送信。通与敌人的斗争，冬子渐渐成长，替母亲报仇的时刻也终于来到。
83,https://movie.douban.com/subject/1297304/,笑傲江湖,Swordsman,笑傲江湖 / Swordsman,8.0,111837,胡金铨 / 徐克 / 李惠民 / 程小东,黄鹰 / 梁耀明 / 戴富浩 / 林纪陶 / 刘大木 / 关文亮 / 金庸,许冠杰 / 叶童 / 张学友 / 张敏 / 袁洁莹 / 刘兆铭 / 元华 / 刘洵 / 林正英 / 午马,1990,1990-01-27(中国台湾) / 1990-04-05(中国香港),中国香港 / 中国台湾,粤语,118分钟,118,,,,,动作 / 武侠 / 古装,大内库藏武功秘笈《葵花宝典》失窃。东厂主管太监古今福（刘洵 饰）率千户欧阳全（张学友 饰）等，南下调查辞官锦衣卫林镇南，同时收用“五岳盟主”左冷禅（元华 饰）外围策应。华山派大弟子令狐冲（许冠杰 饰）与师妹岳灵珊（叶童 饰）奉师命增援林镇南，无奈两人实力不济，领得林镇南遗嘱后遁走，二人于路先后巧遇顺风堂堂主刘正风（午马 饰）、日月神教长老曲洋（林正英 饰）、华山派风清扬，获传《笑傲江湖》曲谱和独孤九剑。 各路人马为《葵花宝典》纷纷聚于苗人地界，欧阳全与左冷禅争功不下，遂假扮林平之混入华山派一行。令狐冲结识日月神教任盈盈（张敏 饰）与蓝凤凰（袁洁莹 饰），因曲洋之关系得其协助。古今福与岳不群为《葵花宝典》大打出手，令狐冲不忍一班师兄弟受牵连愤而使出独孤九剑，始明了“笑傲江湖”真意。 本片根据金庸同名小说改编。
