,url,电影名称,别名,全部名称,电影评分,评分人数,导演,编剧,主演,上映年份,首映日期,国家,语言,片长raw,片长,季数,集数,单集片长raw,单集片长,类型,剧情简介
0,https://movie.douban.com/subject/2147121/,偷偷爱着你 花ざかりの君たちへ：～イケメン♂パラダイス～,花样少男少女 / 花君 / Hana zakari no kimi tachi e: Ikemen paradaisu,偷偷爱着你 花ざかりの君たちへ：～イケメン♂パラダイス～ / 花样少男少女 / 花君 / Hana zakari no kimi tachi e: Ikemen paradaisu,8.1,66821,松田秀知,武藤将吾 / 中条比纱也,堀北真希 / 小栗旬 / 生田斗真 / 冈田将生 / 水岛宏 / 山本裕典 / 木村了 / 上川隆也 / 绀野真昼 / 石垣佑磨,2007,2007-07-03(日本),日本,日语,,,,12,54分钟,54,剧情,樱咲学园是一所寄宿制男子高中，众帅哥汇聚于此，引得少女们的疯狂追逐。某日，学校里来了位美国来的转学生——芦屋瑞稀（堀北真希饰），可是谁也不知道这个“他”竟然是女扮男装！ 其实瑞稀千里迢迢从美国而来全是为了一个人：佐野泉（小栗旬饰）。佐野曾经救过瑞稀，但是却意外受伤，后来还放弃了跳高事业，整个人充满了颓废气息。内疚的瑞稀就是回来“拯救”佐野的。 在帮助佐野重拾跳高的过程中，瑞稀还结识了许多好朋友：可爱率真的秀一（生田斗真饰）、花心风流的难波南（水嶋ヒロ饰）、充满神秘气息的萱岛大树（山本裕典饰）等等。瑞稀和他们共同谱写了一曲最美妙的青春乐章。
1,https://movie.douban.com/subject/1297068/,中南海保镖 中南海保镳,The Bodyguard from Beijing / The Defender,中南海保镖 中南海保镳 / The Bodyguard from Beijing / The Defender,7.8,110577,元奎,陈嘉上 / 陈建忠,李连杰 / 钟丽缇 / 郑则仕 / 邹兆龙 / 梁荣忠 / 黄锦江 / 元奎 / 伍卫国 / 朱威廉 / 迈克尔·米勒,1994,1994-07-28(中国香港),中国香港,粤语,93分钟,93,,,,,剧情 / 动作,香港地区一起杀人案的唯一目击证人Michelle（钟丽缇 饰）正被杀手追杀，因为其未婚夫是与大陆高层关系密切的富商，身手不凡的中国特警许正阳（李连杰 饰）便被中央委派去香港保护Michelle。 两人初接触时互看两生厌，但慢慢都发现了对方的优点并产生了感情，然而因为身 份和工作性质，许正阳尽量将感情压抑，却免不了在刻意回避时患得患失，就在两人感觉无从择决时，一个异常危险的杀手悄悄靠近了他们。
2,https://movie.douban.com/subject/1299769/,第六感生死缘 Meet Joe Black,情约今生(港) / 第六感生死恋 / 遇见死神,第六感生死缘 Meet Joe Black / 情约今生(港) / 第六感生死恋 / 遇见死神,8.0,103564,马丁·布莱斯特,Ron Osborn / Jeff Reno / 凯文·韦德 / 博·古德曼 / Alberto Casella / 沃尔特·费里斯 / 马克斯韦尔·安德森 / 格拉迪斯·雷曼,布拉德·皮特 / 安东尼·霍普金斯 / 克莱尔·弗兰妮 / 杰克·韦伯 / 马西娅·盖伊·哈登 / 杰弗里·塔伯 / David S. Howard / Richard Clarke / 玛丽路易丝·贝克 / 朱恩·斯奎布 / 吉恩·坎菲尔德 / 苏珊娜·赫弗纳 / Julie Lund / 斯蒂芬·阿德利·葛尔盖 / 埃里克·布鲁诺·伯格曼 / 卡德罗莎·奥娜·卡罗尔 / Brian Eggleston / Glenn Phillips / Dale Resteghini / 尼克·斯特拉特,1998,1998-11-13(美国),美国,英语 / 荷兰语,178分钟,178,,,,,爱情 / 奇幻,也许在爱情的天平上，神与人是平等的。 死神为了体验人世的悲欢，化身翩翩少年Joe Black(布拉德•皮特 Brad Pitt 饰) 降落到新闻媒体大亨William Parrish（安东尼•霍普金斯 Anthony Hopkins 饰）的家中。机缘巧合，Joe爱上了William的小女儿Susan （克莱尔•馥兰妮 Claire Forlani饰），品尝到人世间爱情的甘醇。这孩子般纯真的，迷恋花生酱的翩翩死神与他美丽端庄的，拥有夜色深邃眼睛的女孩会有着什么样不同寻常的奇遇？他们把爱情谱成乐章，邀你我一同聆听。
3,https://movie.douban.com/subject/1307681/,榴莲飘飘 榴槤飄飄,Durian Durian,榴莲飘飘 榴槤飄飄 / Durian Durian,7.7,38343,陈果,陈果 / Wai-Keung Chan / Zhi Min Sheng,秦海璐 / 麦惠芬 / Xiao Ming Biao / Wai Yiu Yung / Kwok-Ping Cheung / Fanny Fen-Ni / Qingyong Hu / 嘉嘉 / 李苹 / 李爽 / Zhihan Lu / Suet-man Mak / Kam Yiu Ngai / Ming Wong / Rong Yang,2000,2000-11-16(中国香港) / 2000-09-08(威尼斯电影节),中国大陆 / 中国香港 / 法国,汉语普通话 / 粤语,116分钟,116,,,,,剧情,学了九年京剧却在内地没有出路的阿燕（秦海璐）不得已来到旺角理智地化为妓女挣快钱，并给自己定下（做到双程护照到期的）期限，在所住小巷结识同样来自大陆但是非法入境的少女阿芬（麦惠芬）后，她被阿芬在逆境中的乐观与单纯打动，两人在异乡成为朋友。 返回牡丹江小镇换作另一种身份决定好好生活时，阿燕发现周围世界已与她所理解的大不相同，见识到现实中另外的（不同于在港时的）残酷与无情，心生失落，而当收到阿芬寄来的榴莲时，各种复杂滋味涌上她心头。
4,https://movie.douban.com/subject/3078386/,道林·格雷 Dorian Gray,美少年格雷的画像 / 墮落美少年(港) / 不死魔咒 / 道·格雷的画像 / 道·格雷,道林·格雷 Dorian Gray / 美少年格雷的画像 / 墮落美少年(港) / 不死魔咒 / 道·格雷的画像 / 道·格雷,6.8,45896,奥利弗·帕克,Toby Finlay / 奥斯卡·王尔德,本·巴恩斯 / 约翰·霍林沃思 / Cato Sandford / 皮普·托伦斯 / 费奥纳·肖 / 本·卓别林 / 卡罗琳·古多尔 / 玛瑞亚·达波 / 迈克尔·卡尔金 / 科林·费尔斯 / 艾米莉娅·福克斯 / Nathan Rosen / Jeff Lipman / Louise Kempton / 道格拉斯·韩歇尔 / 蕾切儿·哈伍德 / 约翰尼·哈里斯 / 大卫·斯特恩 / 乔·伍德考克 / 马克斯·艾恩斯 / 丽贝卡·豪尔 / 休·罗斯 / Jules Smith / 诺利·麦克库尔 / 若昂·科斯塔·梅内塞斯 / 丹尼尔·纽曼 / Tallulah Sheffield,2009,2009-09-11,英国,英语,112 分钟,112,,,,,剧情 / 惊悚 / 奇幻,穷小子道林格雷（本·巴恩斯 Ben Barnes 饰）从乡下来到伦敦，结识了社交场上的著名画家巴兹尔（本·卓别林 Ben Chaplin 饰）和绅士亨利（科林·费斯 Colin Firth 饰），两人见他长相俊美，所以引荐他进入社交名流圈。巴兹尔专门以他为人体模特，画了 一幅细腻入微、栩栩如生的半身肖像画，立刻引起社交圈的惊艳和赞叹。从此，格雷进入了名利场，每日过着五光十色的生活。一次偶然的机会，他爱上了小剧场演员塞西莉亚，两人一见钟情，私定终身。听说格雷要结婚，亨利便开始诱导他，不要相信婚姻，应该好好享受风月。于是，格雷跟爱人之间产生了矛盾，后来人们在河中发现了她怀孕的尸体，这让他非常震惊和懊恼，但是无力挽回。格雷彻底堕落，不断用女人、酒精甚至毒品麻醉自己。一个灵魂从此走上了邪恶的道路…… 本片根据英国作家王尔德发表于1891年的第一篇小说《道林·格雷的画像》改编。
5,https://movie.douban.com/subject/3642866/,维多利亚一号 維多利亞壹號,维多利亚的港湾 / Dream Home,维多利亚一号 維多利亞壹號 / 维多利亚的港湾 / Dream Home,7.3,68290,彭浩翔,彭浩翔 / 曾国祥 / 尹志文,何超仪 / 陈奕迅 / 周俊伟 / 曾国祥 / 单立文 / 王青 / 卢海鹏 / 麦浚龙 / 叶璇 / 徐少强 / 鲍起静 / 宋小澄 / 周楚濋 / 骆应钧 / 陈伟雄,2010,2010-05-13,中国香港,粤语,96分钟,96,,,,,剧情 / 恐怖 / 犯罪,某银行话务员邓丽嫦（何超仪 饰）自幼生长在一个平民家庭，她始终有一个情结，那就是努力赚钱买一套可以看得见大海的房子。为了这个目标，阿嫦努力工作，下班后还干着两份兼职，甚至和同事利用职务之便聚敛外快。眼看就要存够豪华大厦维多利亚一号的首付，但是偏偏赶上楼市疯涨的时候，签合 同当天房主反悔，宁可赔付违约金也不愿按原价出售。为了房子而不懈努力的阿嫦遭受巨大打击，在万圣节前夜，这个几近崩溃的女子带着一身杀意走进了维多利亚一号……
6,https://movie.douban.com/subject/1308480/,那时花开,Where Have All The Flowers Gone,那时花开 / Where Have All The Flowers Gone,7.0,20831,高晓松,高晓松,周迅 / 夏雨 / 朴树 / 李明 / 舒耀瑄 / 田震,2002,2002-05(中国大陆),中国大陆,汉语普通话,90分钟,90,,,,,爱情,他们的故事发生在大学期间，最美丽的岁月和最难忘的画面，都在迅速铺开。高举（夏雨 饰）在女朋友出国后迎来了一个乐队合伙人张扬（朴树 饰）。他们生性自由散漫，一天在礼堂顶上看着刚入学的新生，遇见了欢子（周迅 饰）。欢子在人群中耀眼的美丽让他们倾心，并开始了攻势。高举出于友谊第一的考虑，同意只在周六才和欢子一起。三人之间依稀的感情始终在青葱岁月里暗暗流动，他们在青春里，或许都有自己随心所欲的率性和幻想。 “后来，我们分道扬镳，发誓不再提起往事。欢子就象从我们手指间流走的那种叫作岁月的东西一样，偶而还会涌上心头。”在高举他们心中，这就是最好的时光。
7,https://movie.douban.com/subject/1915393/,娜娜2 NANA 2,娜娜Nana 2：与你有约,娜娜2 NANA 2 / 娜娜Nana 2：与你有约,6.4,31669,大谷健太郎,大谷健太郎,中岛美嘉 / 市川由衣 / 玉山铁二 / 姜畅雄 / 成宫宽贵 / 丸山智己 / 本乡奏多 / 伊藤由奈,2006,2006-12-09(日本),日本,日语,130 分钟,130,,,,,剧情 / 爱情,喧哗东京，同年出生的大崎娜娜（中岛美嘉 饰）和小松奈奈（市川由衣 饰）同住一起，各自经历着激荡绚烂的青春。娜娜和乐队BlackStone同心协力，携手朝着目标奋勇前进。虽然娜娜曾经发出警告，但是因失业而烦闷的奈奈还是未能抵挡Trapnest的队长一之濑巧（玉山铁二 饰）的诱惑，而与之陷入热恋。一向将工作放在首位而在男女之事上表现随便的巧，其作为自然引起周围人的不满，尤其是对奈奈心存爱恋的寺岛伸夫（市川由衣 饰）。伸夫的赤诚与执着，对比巧的冷漠轻浮，终于让痛苦的奈奈做出了决定。全新的恋情，全新的道路，这群年轻人还将经历更多的考验…… 本片根据矢泽爱的同名小说改编。
8,https://movie.douban.com/subject/1892510/,保姆日记 The Nanny Diaries,豪门保姆日记,保姆日记 The Nanny Diaries / 豪门保姆日记,6.9,45194,莎里·斯宾厄·伯曼 / 罗伯特·帕西尼,莎里·斯宾厄·伯曼 / 罗伯特·帕西尼,斯嘉丽·约翰逊 / 劳拉·琳妮 / 克里斯·埃文斯 / 保罗·吉亚玛提 / 唐纳·墨菲 / 约翰·亨利·考克斯 / 艾丽西亚·凯斯,2007,2007-08-24(美国),美国,英语,106 分钟,106,,,,,剧情 / 喜剧 / 爱情,安妮（斯嘉丽•约翰逊 饰），一名出身于普通工人家庭的纽约大学毕业生，带着母亲的殷切希望准备成为一名成功的职业女性。但是，就在安妮对自己的前途与未来感到迷茫的时候，一个意外却打破了她原本的生活轨迹，她在纽约上东区第五大道的X家找到了一份保姆的工作——全天候照顾X家四岁的儿子格莱尔。但是，这份收入不菲的工作却不像自己想象中那么轻松。 除了和任性淘气的格莱尔打交道外，安妮还要负责一些家中的杂活儿，同时隐瞒母亲自己现在的工作。而富有的X家似乎也不像那样光鲜，X先生整日忙着赚钱，不在家中；X太太则忙于购物、打扮、社交，偶尔还对安妮的工作吹毛求疵，夫妇俩不但无暇顾及儿子格莱尔，而且婚姻似乎还出现了裂痕。而此时，一个帅气的富家子弟哈佛（克里斯•伊文斯 饰）却闯进了她的生活。卷入这一切的安妮是否能当好这个富家保姆？她与哈佛将情归何处……
9,https://movie.douban.com/subject/1782006/,七龙珠 ドラゴンボール,龙珠 / Dragonball,七龙珠 ドラゴンボール / 龙珠 / Dragonball,9.3,90712,西尾大介,鸟山明,野泽雅子 / 八奈见乘儿 / 鹤广美,1986,1986-02-26(日本),日本,日语,,,,153,25 分钟,25,喜剧 / 动画 / 奇幻 / 冒险,很久很久以前，曾流传着这样一个传说：世界各地散落着七颗龙珠，只要集齐这些珠子，就可召唤出神龙，而神龙可以帮助你实现任何一个愿望。 住在深山中的小悟空本领高强，偶然的机会他随时尚少女布尔玛走出大山，四处寻找传说中的龙珠。期间碰上好色的鬼仙人与乌龙、一碰女人就面红耳赤的乐平、自大的小和尚克林，经历了各种各样的艰险和奇遇，也惹出一连串爆笑的故事。当然还有许多邪恶的家伙为了满足私欲寻找龙珠，与小悟空他们展开了连番激斗…… 根据鸟山明同名漫画改编。
10,https://movie.douban.com/subject/2357703/,名侦探柯南：通向天国的倒计时 名探偵コナン 天国へのカウントダウン,名侦探柯南2001：通向天国的倒计时 / 名侦探柯南：剧场版第5部 / Meitantei Conan: Tengoku no countdown / Detective Conan: Count Down to Heaven,名侦探柯南：通向天国的倒计时 名探偵コナン 天国へのカウントダウン / 名侦探柯南2001：通向天国的倒计时 / 名侦探柯南：剧场版第5部 / Meitantei Conan: Tengoku no countdown / Detective Conan: Count Down to Heaven,8.7,135723,儿玉兼嗣,青山刚昌 / 古内一成,高山南 / 山崎和佳奈 / 神谷明 / 山口胜平 / 林原惠美 / 岩居由希子 / 高木涉 / 大谷育江 / 堀之纪 / 立木文彦 / 茶风林 / 绪方贤一 / 井上和彦 / 松井菜樱子 / 藤田淑子 / 渡部猛 / 久川绫 / 桥本晃一 / 小杉十郎太 / 中岛聪彦 / 玉川纱己子 / 千叶一伸 / 宇垣秀成 / 菅原淳一 / 一条和矢 / 小西克幸 / 井上隆之 / 百百麻子 / 赤木美绘 / 永井一郎,2001,2001-04-21(日本),日本,日语,100 分钟,100,,,,,动作 / 动画 / 悬疑 / 惊悚,柯南、灰原及少年侦探队成员步美、光彦、元太随博士这日露营完毕，绕道参观西多摩市新建于富士山前的日本第一双塔摩天大楼，毛利小五郎恰也应双塔所有者、他的学妹常盘美绪之邀，携小兰、园子参加开幕典礼。美绪介绍下，他们认识以画富士山闻名的画师如月峰水、市议员大木岩松、双塔的设计者风间英彦（森谷帝二的弟子，第一弹《引爆摩天楼》中，森谷曾向新一挑战）、天才程序员原。期间灰原的举动异常。 大木提前入住B塔被害，目暮警官着手调查发现他与美绪似有不同寻常关系，不久原亦被杀害于家中。因为现场都留有与日本画画师作画时所用的乳钵相似的小酒杯碎片，两起案件似系一人所为。柯南由小酒杯联想到灰原曾效力的、以酒名为绰号的黑暗组织，并注意到第二起案件中碎片上未沾染血迹。与此同时他找到灰原举动异常的原因，却发现她正被人追踪。而园子玩笑弄的发式令她像极了雪莉（灰原）。 开幕酒会上，美绪向宾客展示如月最为宝贵的富士山画作时被杀，死相正如横亘在富士山正中的双塔的缩影图，她的身下也有一个小酒杯，不过却是完好的。地上一颗原本该呆在美绪脖子上的珍珠令柯南将目光转向如月。紧接，A楼美绪公司电脑档案所在的楼层及地下配电室发生爆炸。逃亡时刻，柯南注意到正有一支枪瞄准园子，心中给出了所有疑问的答案，但他及小兰等人最迫切需要解决的却是如何从火海逃脱。
11,https://movie.douban.com/subject/1986338/,歌舞青春2 High School Musical 2,高校音乐剧2 / High School Musical 2: Sing It All or Nothing! / Grease 4,歌舞青春2 High School Musical 2 / 高校音乐剧2 / High School Musical 2: Sing It All or Nothing! / Grease 4,7.3,86442,肯尼·奥特加,彼得·巴索奇尼,扎克·埃夫隆 / 凡妮莎·哈金斯 / 阿什丽·提斯代尔 / 卢卡斯·格拉比 / 科宾·布鲁,2007,2007-08-17(美国),美国,英语,104分钟,104,,,,,剧情 / 喜剧 / 家庭,"高一生涯结束，野猫队的所有成员都准备好迎接美妙的暑假。暗恋特洛伊（扎克·埃夫隆 Zac Efron饰）已久的夏培（阿什丽·提斯代尔 Ashley Tisdale 饰）利用她父亲的影响力帮特洛伊在自家经营的豪华俱乐部中弄到一份工作，和藉机让他获得大学篮球奖学金的机会。而条件是特洛伊必须放弃野猫队,并和夏培搭档参加俱乐部一年一度的才艺比赛。同时，这也是夏培让特洛伊远离女朋友盖比瑞拉（瓦妮莎·哈金斯 Vanessa Hudgens饰）的计谋。可特洛伊让盖比瑞拉被同时被俱乐部录用，让夏培十分气愤。夏培的弟弟莱恩和没了特洛伊的野猫队合作，排练曲目参加比赛。不料被夏培知道，强行取消了他们的资格。盖比瑞拉伤心地从俱乐部辞了职，并开始与特洛伊产生裂痕，野猫队的成员也开始把特洛伊排除在外。 这一次特洛伊到底该选择哪一边的阵营？这个夏天到底会有怎样不一样的抉择？"
12,https://movie.douban.com/subject/1297862/,英雄本色2,英雄本色 续集 / 英雄本色II / A Better Tomorrow II / Yinghung bunsik II,英雄本色2 / 英雄本色 续集 / 英雄本色II / A Better Tomorrow II / Yinghung bunsik II,8.4,183131,吴宇森,徐克 / 吴宇森,狄龙 / 张国荣 / 周润发 / 石天 / 关山 / 朱宝意 / 曾江 / 成奎安 / 吴孟达 / 王正方,1987,1987-12-17(中国香港),中国香港,粤语 / 汉语普通话 / 英语,105 分钟,105,,,,,剧情 / 动作 / 犯罪,第一部中，小马哥（周润发 饰）死在乱枪之下，宋子豪（狄龙 饰）和弟弟宋子杰（张国荣 饰）冰释前嫌，英雄的故事还在继续。 警方怀疑宋子豪的恩师龙四（石天 饰）利用船厂做掩护，暗中操纵伪钞集团，派宋子杰去接近龙四的女儿小辉，做卧底，宋子豪为了弟弟的安全，不得不假释出狱，协助警方调查。 其实，龙四对手下的犯罪行为并不知情，他被亲信高英培陷害，不得不逃亡纽约，女儿的被害，使他精神失常，在小马哥弟弟阿健（周润发 饰）的帮助和保护下，才渐渐恢复神智。出于道义，阿健放弃了经营多年的餐厅，同龙四共同返港。 香港这边，宋氏兄弟几近艰险终于获得了高英培的信任，掌握了伪钞集团的犯罪证据，和阿健、龙四会和后，四人策划了火爆的复仇行动，也付出了鲜血甚至性命的代价。
13,https://movie.douban.com/subject/3074503/,功夫梦 The Karate Kid,新龙威小子 / 功夫小子 / Kung Fu Kid,功夫梦 The Karate Kid / 新龙威小子 / 功夫小子 / Kung Fu Kid,6.4,97512,哈罗德·兹瓦特,克里斯托弗·墨菲 / 罗伯特·马克·卡门,贾登·史密斯 / 成龙 / 塔拉吉·P·汉森 / 韩雯雯 / 于荣光 / 赵毅 / 王姬,2010,2010-06-22(中国大陆) / 2010-06-10(韩国) / 2010-06-11(美国),美国 / 中国大陆,英语 / 汉语普通话,140分钟,140,,,,,剧情 / 动作 / 家庭 / 运动,本片根据好莱坞1984年的同名电影翻拍而成。12岁的德瑞·帕克（贾登·史密斯 Jaden Smith 饰）随母亲（塔拉吉·P·汉森 Taraji P. Henson 饰）由底特律搬家至中国北京，认识了同校拉小提琴的中国女孩美莹（韩雯雯 饰）。德瑞与美莹的交往引起了学校以程（王振威 饰）为首的小团体的不满，在一次打斗中，处于劣势的德瑞被公寓管理员老韩（成龙 饰）所救，却得罪了程的武术老师李师傅（于荣光 饰）。老韩与李师傅约定，由徒弟们在比武大会上一较高下。从此，德瑞师承老韩开始学习中国功夫，从拳脚练习到个性修炼，一点点领会武术及人生的真谛，同时也与老韩建立了深厚的友谊。但只有短期训练的德瑞究竟能否在残酷的比武大赛上战胜程，取得最终胜利呢？
14,https://movie.douban.com/subject/4300525/,待业青年,No Country for Young Man,待业青年 / No Country for Young Man,8.2,23559,张内咸,张内咸,吉硕 / 郭雪萌,2010,2010-02-10,中国大陆,汉语普通话,180 分钟,180,,,,,纪录片,大学生小吉（吉硕 饰）有着不安份的内心，面临毕业的他做出一个惊人决定——退学。因为他厌倦了学校的种种不合常理的现象。在几年的大学生涯里，他对周围的人和事甚至对自己的人生都产生了怀疑，人究竟为什么活着？这个问题始终困扰着他。他感觉每个人都生活在一个早就被制定的牢笼里，人人都缺乏独立的人格和尊严，生活的轨迹是社会和父母早就规划好的，那么我们来到这个世界上到底是为什么。思虑良久，他决定要用一年时间探讨下一步的人生之路。他拿起了DV，走向浩淼的大千社会，去观察记录周围人们的生活状态，重新思考青春的含义......
15,https://movie.douban.com/subject/3011072/,珍爱 Precious,珍爱人生(台) / 天生不是宝贝(港) / 真爱 / 新方向 / 宝贵人生 / 遗失的美好 / Precious: Based on the Novel Push by Sapphire / Push,珍爱 Precious / 珍爱人生(台) / 天生不是宝贝(港) / 真爱 / 新方向 / 宝贵人生 / 遗失的美好 / Precious: Based on the Novel Push by Sapphire / Push,8.1,35832,李·丹尼尔斯,格弗瑞·弗莱彻 / 萨菲尔,加布蕾·丝迪贝 / 莫妮克 / 宝拉·巴顿 / 玛丽亚·凯莉 / 蓝尼·克罗维兹,2009,2009-01-16(圣丹斯电影节),美国,英语,110分钟,110,,,,,剧情,上世纪80年代，又胖又丑的黑人女孩叫克拉丽丝·珍爱·琼斯（嘉伯蕾·西蒂比 Gabourey Sidibe 饰）和暴虐的母亲依靠救济金一起生活，目不识丁的她给自己取名珍爱。年仅16岁的她有个智障女儿的同时还怀有两个月的身孕，而孩子们的父亲就是强奸她的父亲。珍爱时常幻想着自己有迷人的舞姿，有艳丽的舞台，还有一个帅气的男友，而这些只存在于她的白日梦里，现实中的她不但要忍受外人的侮辱，而且还要想办法应付自己亲生母亲的讽刺和刁难。直到她被学校退学并被介绍到一对一选修学校，在那里她认识到其他几个问题少女以及一个让她们每天都写日记的老师布鲁·瑞恩。珍爱慢慢的重新燃起了对生活的热情，可是她却发现自己感染了艾滋病。在希望和不幸的夹缝里，珍爱将何去何从？ 影片由萨菲尔（Sapphire）的小说《推》（Push）改编。第82届奥斯卡上荣获最佳改编剧本和最佳女配角两项大奖；2009年多伦多国际电影节最高奖项——观众选择大奖；第25届圣丹斯国际电影节美国剧情片评审团大奖和观众选择奖。
16,https://movie.douban.com/subject/3006302/,交响情人梦之欧洲特别篇 のだめカンタービレ in ヨーロッパ,交响情人梦新春特别篇：在欧洲 / 交响情人梦 欧洲特别篇 / 交响情人梦：欧洲篇 / Nodame Cantabile in Europe,交响情人梦之欧洲特别篇 のだめカンタービレ in ヨーロッパ / 交响情人梦新春特别篇：在欧洲 / 交响情人梦 欧洲特别篇 / 交响情人梦：欧洲篇 / Nodame Cantabile in Europe,8.9,45904,武内英树,卫藤凛 / 二之宫知子,上野树里 / 玉木宏 / 永山瑛太 / 水川麻美 / 小出惠介,2008,2008-01-04(日本),日本,日语,,,,2,120分钟,120,剧情 / 喜剧 / 爱情 / 音乐,千秋（玉木宏饰）终于摆脱了“惧机症”，不久，野田妹（上野樹里饰）也顺利通过巴黎音乐学院的考试，两人双双飞赴巴黎继续音乐深造。 在拜谒崇拜的维耶拉老师之前，千秋决定先参加国际指挥比赛，小试实力。在舞台上，千秋才华尽展，光彩夺目，面对劲敌也丝毫不落下风，终于顺利捧回桂冠，之后还以指挥家身份“出道”开始在世界各地的巡演。 被千秋“抛下”的野田妹只得独自应付生活：语言障碍、对循规蹈矩的教学不能适应、身边的高手如林……在各种或隐或显的重压下，野田妹陡然对自己的才能产生了怀疑。没有了千秋的陪伴，沮丧的情绪也挥之不去，野田妹的表演遇上了瓶颈！
