,url,电影名称,别名,全部名称,电影评分,评分人数,导演,编剧,主演,上映年份,首映日期,国家,语言,片长raw,片长,季数,集数,单集片长raw,单集片长,类型,剧情简介
35,https://movie.douban.com/subject/2181930/,大宅门,The Grand Mansion Gate,大宅门 / The Grand Mansion Gate,9.4,173055,郭宝昌,郭宝昌,斯琴高娃 / 刘佩琦 / 陈宝国 / 蒋雯丽 / 张丰毅 / 贾妮 / 张艺谋 / 何赛飞 / 姜文 / 李雪健 / 茹萍 / 李洪涛 / 毕彦君 / 雷恪生 / 艾丽娅 / 张定涵 / 雷娟 / 谢兰,2001,2001-04-15(中国大陆) / 2001-06-04(中国香港),中国大陆,汉语普通话,,,,40,45分钟,45,剧情 / 爱情 / 家庭 / 传记 / 历史,《大宅门》由郭宝昌出任编剧和导演，2001年荣获中央电视台收视冠军。 剧中讲述了医药世家白府经历清末、民国、军阀混战、解放等时期的浮沉变化，忠实地反映了同仁堂这个大家族随着国家、民族的历史发展而发展的渐变过程。故事横跨光绪年间、1900年八国联军侵入北京、1911年清朝覆灭、1931年九·一八事变、1937年七·七卢沟桥事变。官场恩怨、情场爱恨、商场输赢。谱写了一曲“宅门”史，展一幅波澜壮阔动荡社会生活画卷，父母子孙、妻妾丫妓、至爱亲朋；“宅门”人，谱一曲世态炎凉悲欢离合命运之歌。
36,https://movie.douban.com/subject/2072478/,怪物史瑞克4 Shrek Forever After,史力加万岁万万岁(港) / 史瑞克快乐4神仙(台) / 怪物史莱克4 / 史瑞克4 / 史力加4 / Shrek 4,怪物史瑞克4 Shrek Forever After / 史力加万岁万万岁(港) / 史瑞克快乐4神仙(台) / 怪物史莱克4 / 史瑞克4 / 史力加4 / Shrek 4,7.6,62069,迈克·米切尔,乔什·克劳斯纳 / 达伦·莱姆克 / 威廉·斯泰格 / 安德鲁·亚当森 / 泰德·艾略特 / 特里·鲁西奥 / 罗杰·S·H·舒尔曼 / 乔·斯蒂尔曼,麦克·梅尔斯 / 艾迪·墨菲 / 卡梅隆·迪亚兹 / 安东尼奥·班德拉斯 / 朱莉·安德鲁斯 / 乔恩·哈姆 / 约翰·克里斯 / 沃尔特·道恩 / 简·林奇 / 克雷格·罗宾森 / 蕾克·贝尔 / 凯西·格里芬 / 玛丽·凯·普莱斯 / 克里斯汀·沙尔 / 梅勒迪斯·维埃拉 / 瑞安·西克莱斯特 / 科迪·卡梅伦 / 拉里·金 / 里吉斯·菲尔宾 / 克里斯多夫·奈茨 / 康拉德·弗农 / 阿伦·沃纳 / 迈尔斯·克里斯托弗·巴克什 / 迈克·米切尔 / 詹姆斯·雷恩 / 阿什利·博彻 / 弗兰克·维尔克,2010,2010-08-16(中国大陆) / 2010-05-21(美国),美国,英语,93分钟,93,,,,,喜剧 / 动作 / 动画 / 冒险,史莱克（麦克·梅尔斯 Mike Myers 配音）与菲奥纳公主（卡梅隆·迪亚兹Cameron Diaz 配音）和三胞胎宝贝幸福生活在一起后，他却对日复一日的平淡生活不满起来。在一次与菲奥纳公主激烈争吵后，他遇到了魔法师侏儒怪（沃尔特·道恩 Walt Dohrn 配音），并与其签订了“一天换一天”的魔法条约。但史莱克没想到，侏儒怪拿走的竟是他出生的那天，结果整个遥远王国变得面目全非，侏儒怪成了国王，派出无数女巫到处搜捕食人魔为奴。而若在日出之前史莱克无法获得菲奥纳公主的真爱之吻，他将彻底消失。焦急的史莱克再次初遇好朋友骡子（艾迪·墨菲 Eddie Murphy 配音），而靴猫剑客（安东尼奥·班德拉斯 Antonio Banderas 配音）则变成了菲奥纳公主的宠物肥猫。在他们的帮助下，史莱克竭尽全力赢取菲奥纳公主的芳心，只可惜事态发展远不如想象顺利……
37,https://movie.douban.com/subject/1294114/,冒险王 冒險王,Dr. Wai in the Scripture With No Words,冒险王 冒險王 / Dr. Wai in the Scripture With No Words,6.8,60206,程小东,林伟伦 / 邵丽琼 / 司徒卓汉,李连杰 / 关之琳 / 金城武 / 杨采妮 / 罗家英 / 邹兆龙 / 周比利 / 江约诚,1996,1996-03-14(中国香港) / 1996-02-10(韩国),中国香港 / 中国大陆,粤语 / 汉语普通话,90分钟,90,,,,,动作,小说家周时杰（李连杰）被妻子莫尼卡（关之琳）闹离婚，郁闷之下开始编写剧集《冒险王》的剧本，想象中他成了民国时代的冒险王卫亦信，莫妮卡变作日本特务加美子，借此宣泄郁闷。 唐三藏当年西天取得、今下落不明的无字真经成为中国及日本政府争抢的目标，为免日本人捷足先登，中国政府邀请考古专家卫亦信及其徒弟阿城（金城武）追查真经下落，得知线索在经盒表面，两人混入日本领事馆，结识身份神秘的美女加美子，后两人又追线索到某日报社，从编辑英叔（罗家英）口中知晓经盒下落，但消息亦被加美子得知。
38,https://movie.douban.com/subject/3155477/,爱有来生,银杏，银杏 / Eternal Beloved,爱有来生 / 银杏，银杏 / Eternal Beloved,7.7,84942,俞飞鸿,俞飞鸿 / 须兰,俞飞鸿 / 段奕宏 / 李佳 / 姚橹 / 涂松岩,2009,2009-09-03(中国大陆),中国大陆,汉语普通话,96分钟,96,,,,,剧情 / 爱情,小玉（俞飞鸿饰）与丈夫秦言（涂松岩饰）在儿时旧友雅萍（李佳饰）的帮助下搬入山顶一处僻静宅院。秦言外出代课，小玉独自打理庭院，尤其对院中的银杏树倾心。某晚小玉沏茶独自等待雅萍来访，却突遇一和尚打扮的男鬼阿明（段奕宏饰）树下现身。阿明说自己已在银杏树下等人五十载。经小玉同意，阿明开始缓缓讲述五十年前的一段经历。阿明的哥哥（姚橹饰）作为山寨头领，在一次仇杀中放走仇家六岁半的儿子。十几年后，弟弟阿明爱上了一个突如其来的神秘女子阿九（俞飞鸿饰）。阿明百般呵护却依然无法赢得阿九的芳心。绝望中阿明出家为僧，阿九却又不离不弃，直到有一天帮派火拼，一切因果真相大白却又无可挽回……
39,https://movie.douban.com/subject/1451911/,独家新闻 Scoop,遇上塔罗牌杀手(港) / 遇上塔罗牌情人(台) / 塔罗牌杀人事件 / 独家头条,独家新闻 Scoop / 遇上塔罗牌杀手(港) / 遇上塔罗牌情人(台) / 塔罗牌杀人事件 / 独家头条,7.3,60628,伍迪·艾伦,伍迪·艾伦,斯嘉丽·约翰逊 / 休·杰克曼 / 伍迪·艾伦 / 伊恩·麦柯肖恩 / 萝玛拉·嘉瑞,2006,2006-07-28(美国),英国 / 美国,英语,96分钟,96,,,,,喜剧 / 爱情 / 悬疑 / 奇幻,一个美国女大学生桑德拉（斯嘉丽·约翰逊 Scarlett Johansson 饰），为了替学校报纸寻找独家新闻，来到英国伦敦采访一个电影导演。在调查和采访的过程中，她参加了魔术师希德（伍迪·艾伦 Woody Allen 饰）一次魔术戏法表演，在密闭的箱中她遇见了一个离世 的资深记者鬼魂。记者生前是一个为了拿到独家新闻无所不尽其用的人。他在去往阴间的船上从一个被害的前任秘书口中得知“塔罗牌杀手”竟然是英俊多金的贵族彼得（休·杰克曼 Hugh Jackman 饰）。他不想让这有爆炸性的新闻埋葬，于是找上桑德拉希望她帮他完成心愿。 面对这个千载难逢的机会，桑德拉决定深入虎穴，拉上魔术师希德假扮父女混进上流社会，接近彼得。事情顺利得令人惊讶，桑德拉与彼得成了甜蜜的一对。然而塔罗牌杀手又继续行动……
40,https://movie.douban.com/subject/5250583/,最强囍事 最強囍事,最强喜事 / 至强喜事 / All's Well Ends Well 2011,最强囍事 最強囍事 / 最强喜事 / 至强喜事 / All's Well Ends Well 2011,5.2,76178,陈庆嘉 / 秦小珍,黄百鸣 / 何妙祺,张柏芝 / 古天乐 / 甄子丹 / 刘嘉玲 / 黄百鸣 / 闫妮 / 熊黛林 / 杜汶泽 Chapman To / 杨颖 / 汪圆圆 / 郑中基,2011,2011-01-31(中国大陆/中国香港),中国大陆 / 中国香港,粤语 / 汉语普通话,103分钟,103,,,,,喜剧 / 爱情,《最强囍事》豆瓣官方小站：http://site.douban.com/111545/ 化妆师沈美（古天乐 饰）在上一档电视节目时出现了尴尬，原来平素娘娘腔的他为了生活一直在伪装。他化妆学校的同学郑宇强（甄子丹 饰）在深圳一家美容专柜做化妆师，以高超的技巧赢得无数粉丝，但惟独没有俘获初恋女友戴梦妮（刘嘉玲 饰））的芳心。后者为了写小说，总是通过易容来贴近人物。陈奇侠（黄百鸣 饰）是石油大亨，唯一怕的就是他女友Dream（闫妮 饰）。后者因为观看电视节目，成了沈美的粉丝。夫妻俩联手，让沈美签下了合同，成了其化妆品公司的CEO。沈美为钱所动，走马上任，发现公司同事清一色都是美女。身为娘子军的他，有一个朴实的助理简洁（张柏芝 饰）。一次偶然的机会，游艇王子滑溜溜（杜汶泽 饰）看上了简洁，两人开始约会。但是经常受到滑溜溜前女友Victoria（熊黛林 饰）的骚扰。在这个过程中，沈美却逐渐发现了简洁与众不同的美……
41,https://movie.douban.com/subject/3007826/,摔角王 The Wrestler,拼命战羊(港) / 力挽狂澜(台) / 摔跤王 / 摔角手 / 摔跤手,摔角王 The Wrestler / 拼命战羊(港) / 力挽狂澜(台) / 摔跤王 / 摔角手 / 摔跤手,8.3,46736,达伦·阿伦诺夫斯基,罗伯特·D·西格尔,米基·洛克 / 玛丽莎·托梅 / 埃文·蕾切尔·伍德 / 马克·马戈利斯 / 托德·巴里 / 沃斯·史蒂文斯 / 贾达·弗雷德兰德 / 欧内斯特·米勒 / 迪伦·基思·萨默斯 / 玛西娅·让·库尔茨 / 约翰·德利奥 / 阿杰·奈杜 / 亚伯拉罕·阿罗诺夫斯基 / 夏洛特·阿罗诺夫斯基,2008,2008-09-05(威尼斯电影节) / 2008-12-17(美国),美国 / 法国,英语,109 分钟,109,,,,,剧情 / 传记 / 运动,绰号“大锤”的兰迪•罗宾森（Mickey Rourke 米基•洛克 饰）是上世纪80年代美国独立摔角圈中一颗耀眼的明星，他留下了无数经典的比赛，其绝招“大锤粉碎压”更虏获众多狂热的摔角爱好者。 但随着行业的飞速发展和身体健康状况的下降，属于“大锤”的时代早已远去。出于对摔角的热爱，兰迪始终没有离开这个圈子，他忍受着生活拮据，忍受着伤痛困扰，只为了和陪伴多年的摔角迷们享受每一次秀所带来的莫大快乐。他固执地追逐着最后一丝荣光，私人生活却越来越糟。长年奔波以致和女儿斯蒂芬妮（Evan Rachel Wood 埃文•蕾切尔•伍德 饰）的关系疏远，剧烈的撞击和不断摄取处方药又令他的心脏接近崩溃边缘。孤独的他只能在每次艰苦的比赛之后，从脱衣舞女卡西迪（Marisa Tomei 玛丽莎•托梅 饰）那里得到些许短暂的安慰。 因身体的原因，兰迪决定退出摔角圈，做一份稳定的工作，并找回家庭的温暖。但经理人策划了一场二十周年的经典重赛。为了毕生钟爱的摔角、为了狂热执著的摔角迷、为了心中长久以来所坚持的，兰迪终于再次披挂上阵，重返擂台…… 本片荣获2008年威尼斯电影节金狮奖、2009年英国艺术电影电视学院奖（BAFTA）最佳男主角奖（Mickey Rourke）、2009年金球奖最佳原创歌曲和最佳男主角。
42,https://movie.douban.com/subject/1302769/,我的失忆男友 失憶界女王,"Why Me, Sweetie ?!","我的失忆男友 失憶界女王 / Why Me, Sweetie ?!",6.3,29691,马楚成,陈淑贤 / 容雅慧,古天乐 / 应采儿 / 刘以达 / 刘蓓 / 邵小珊 / 隋俊波 / 吉祥 / 林海海 / 韩雯雯,2003,2003-04-10,中国大陆 / 中国香港,汉语普通话 / 粤语,97 分钟(香港),97,,,,,喜剧 / 爱情,丁叮（应采儿 饰）从美国回来后到了北京戏剧学院读书，一次偶然的机会她认识了阿当（古天乐 饰），这名大帅哥是出了名的“花心大萝卜”，他却对性格爽朗，外表清秀的丁叮。他遇见丁叮的时候正在甩掉一堆追求他的女生。两人在匆忙间一见钟情，彼此倾心。 不久，阿当便向丁叮表达了爱意，两人顺利坠入爱河，共享了许多甜蜜的热恋时光。可是好景不长，阿当患上了失忆症，把丁叮当作了陌路人。丁叮顿时晴天霹雳，但面对深爱的阿当，她不懈努力，要与阿当重新开始。 丁叮以为两人能够从此幸福的走下去，但阿当的失忆症状总是不时发作，一次次忘掉丁叮……
43,https://movie.douban.com/subject/3018122/,玩命快递3 Transporter 3,非常人贩3 / 玩命速递3 / 绝命速递3,玩命快递3 Transporter 3 / 非常人贩3 / 玩命速递3 / 绝命速递3,7.1,79353,奥利维尔·米加顿,吕克·贝松 / 罗伯特·马克·卡门,杰森·斯坦森 / 娜塔尔雅·卢达科娃 / 弗朗索瓦·贝莱昂 / 罗伯特·克耐普 / 杰罗恩·克拉比 / 亚历克斯·柯博德 / 大卫·阿特拉基 / 杨·桑德博格 / 艾瑞克·艾伯纳尼 / 大卫·卡门诺斯 / 西尔维奥·西马克 / 奥斯卡·赖尔 / 蒂莫·迪尔克斯 / 伊戈尔·昆潘 / 保罗·巴雷特 / 埃莱夫·扎克 / 卡琪娅·申库 / 米歇尔·纽嘉腾 / 法里德·艾劳阿迪 / 迈克·鲍尔斯 / 菲利普·梅马特 / 弗兰克·内尔 / 让-卢克·波切洛特 / 托尼奥·迪斯坎维尔 / 斯蒂芬·克罗斯 / 马夏尔·贝佐特 / 斯蒂芬·沙戈夫 / 阿诺·吉尔比 / 吉约姆·内尔 / 丹尼斯·布鲁西妮 / 斯特福·利纳德 / 艾琳·斯蒂努斯 / 凯特·泰森 / 爱艾萨·布斯塞塔 / 萨米·西尔特 / 埃里克·莫罗,2008,2009-02-12(中国大陆) / 2008-11-26(法国),法国,英语 / 法语 / 乌克兰语 / 俄语 / 匈牙利语,104分钟,104,,,,,动作 / 犯罪,超强押运人弗兰克·马丁（杰森·斯坦森 Jason Statham 饰）平静的休假再次被打破，一名驾驶着奥迪车的男人载着一名女孩在马赛横冲直撞，与此同时，商人约翰森（Robert Knepper 饰）为了向乌克兰运输有毒物质正与该国环境部长针锋相对。受伤的奥迪车司机闯入弗兰克家中，并死于手腕上的炸弹，他的幕后老板约翰森强迫弗兰克接替运送女孩的任务，被安装了手腕炸弹的弗兰克不得不就范，因为只要他离开车子75英尺炸弹就会引爆。在前往布达佩斯的路上，弗兰克终于明白任务的真相：女孩瓦伦汀娜（Natalya Rudakova 饰）是乌克兰环境部长之女，约翰森为使部长批准他的计划而掳走瓦伦汀娜，在约翰森和部长两路人马的追击中，弗兰克该如何化解这次的危机？
44,https://movie.douban.com/subject/1309078/,星球大战前传3：西斯的反击 Star Wars: Episode III - Revenge of the Sith,星球大战前传III：黑帝君临(港) / 星际大战三部曲：西斯大帝的复仇(台) / 星球大战前传3：西斯的复仇 / 星球大战第三集：西斯的复仇 / 星战前传之西斯的复仇 / 西斯的反击,星球大战前传3：西斯的反击 Star Wars: Episode III - Revenge of the Sith / 星球大战前传III：黑帝君临(港) / 星际大战三部曲：西斯大帝的复仇(台) / 星球大战前传3：西斯的复仇 / 星球大战第三集：西斯的复仇 / 星战前传之西斯的复仇 / 西斯的反击,8.5,107782,乔治·卢卡斯,乔治·卢卡斯,伊万·麦克格雷格 / 娜塔莉·波特曼 / 海登·克里斯滕森 / 伊恩·麦克迪阿梅德 / 塞缪尔·杰克逊 / 吉米·斯密茨 / 弗兰克·奥兹 / 安东尼·丹尼尔斯 / 克里斯托弗·李 / 凯莎·卡斯特-休伊斯 / 西拉斯·卡森 / Jay Laga'aia / 布鲁斯·斯宾斯 / 韦恩·佩格拉姆 / 特穆拉·莫里森 / 奥利弗·福德·戴维斯 / 阿梅德·贝斯特 / 杰米·布洛奇 / 肯尼·贝克 / 彼德·梅犹 / 乔尔·埃哲顿 / 邦妮·皮耶斯 / 艾米·爱伦 / Graeme Blundell / 特丽莎·诺贝尔 / 克劳迪娅·卡万 / Keira Wingate / 吉娜薇·欧瑞丽 / 奇·陈 / 丽纳·欧文 / 克里斯托弗·卡比 / 马修·伍德 / 克里斯蒂·莱特 / Mousy McCallum / Michael Kingma / 大卫·阿克德 / Jill Brooks / 罗布·科尔曼 / 本·库克 / 卡罗琳·德索扎 / 纳许·埃哲顿 / 尼克·吉拉德 / 罗杰·盖耶特 / 尼克·詹姆森 / 詹姆斯·厄尔·琼斯 / Ali Keshavji / 戈兰·D·克鲁特 / 约翰·诺尔 / Nalini Krishan / 约翰·莱文 / 白灵 / 乔治·卢卡斯,2005,2005-05-20(中国大陆) / 2005-05-19(美国),美国,英语,140分钟,140,,,,,动作 / 科幻 / 奇幻 / 冒险,克隆战争已经进行了三年，共和国即将胜利，分裂联盟的格非特将军和杜库伯爵（克里斯托弗•李 Christopher Lee 饰）劫持议会首相帕尔帕庭（伊恩·迈克蒂安米德Ian McDiarmid 饰）潜逃，绝地武士欧比-旺•肯诺比（伊万•麦克格雷格 Ewan McGregor 饰）和阿纳金（海登·克里斯滕森 Hayden Christensen 饰）奉长老院命前去营救，阿纳金杀死杜库伯爵救出帕尔帕庭，但格非特将军逃匿。阿纳金梦见妻子阿米达拉（娜塔丽·波特曼 Natalie Portman 饰）将死于难产，困惑中求助于帕尔帕庭，后者趁此机会离间阿纳金与绝地长老院。随着阿纳金向帕尔帕庭的靠拢，一场针对绝地武士与其所捍卫之民主的阴谋逐渐展开。 本片提名2006年第78界奥斯卡最佳化妆奖，并提名格莱美最佳电影电视等视觉媒体原创音乐奖。
45,https://movie.douban.com/subject/2214140/,合约情人,Contract Lover / The Contract Love,合约情人 / Contract Lover / The Contract Love,5.4,58744,张坚庭,张坚庭 / 黄宏基 / 蒋丹,任贤齐 / 范冰冰 / 徐子珊 / 元华 / 刘忆 / 刘仪伟 / 恒力 / 杨志英 / 张坚庭,2007,2007-08-16(中国大陆),中国大陆,汉语普通话,94分钟,94,,,,,喜剧 / 爱情,霍启发（任贤齐饰）事业有成，收入不菲，却为女朋友一事而苦恼。他女友Rachel（徐子珊饰）甚为西化，着装开放暴露，正是见家长的大忌。父母催婚，为了让他们接受Rachel ，霍启发决定征选合约情人，带回老家。 刘枣（范冰冰饰）是待业大学生，家境贫寒，应征成功令她开始了合约情人的身份。霍启发带她来到佛山老家，让她做尽令老人家失望之事。但刘枣和霍家关系竟越来越好，事情竟然往料想不到的方向发展。霍启发、Rachel和刘枣三人之间如何纠结？刘枣这个情人到底有多长的合约？
46,https://movie.douban.com/subject/1433736/,古惑仔之人在江湖,英雄不败(台) / Young and Dangerous,古惑仔之人在江湖 / 英雄不败(台) / Young and Dangerous,7.9,134017,刘伟强,文隽,郑伊健 / 陈小春 / 吴镇宇 / 黎姿 / 林晓峰 / 谢天华 / 林尚义 / 朱永棠 / 吴志雄 / 任达华 / 夏萍 / 罗兰 / 王龙威 / 陈秀茹,1996,1996-01-25(中国香港),中国香港,粤语,97 分钟,97,,,,,动作 / 犯罪,陈浩南（郑伊健 饰）、山鸡（陈小春 饰）、巢皮等人从少年时代起就是好友。他们无心读书，一心向往江湖生活。终于有江湖人士大佬B收纳为徒，开始闯荡江湖。浩南在一次黑帮仇杀中大展拳脚，杀死了黑道大哥巴闭，因此与另一头目靓坤( 吴镇宇 饰)结下深仇。靓坤设法加害浩南，令浩南兄弟巢皮惨死，而浩南误服药物与山鸡女友发生关系，兄弟间开始积怨。浩南心灰意冷，打算收手，怎料大佬B遭全家灭门，自己经营的店铺被烧毁，靓坤的步步相逼令浩南忍无可忍。
47,https://movie.douban.com/subject/1817253/,樱兰高校男公关部 桜蘭高校ホスト部,Ouran High School Host Club / 樱兰高校Host部,樱兰高校男公关部 桜蘭高校ホスト部 / Ouran High School Host Club / 樱兰高校Host部,8.9,97178,五十岚卓哉 / 京田知己 / 金子伸吾 / 安斋刚文 / 松尾慎 / 佐藤育郎 / 角田一树 / 森山雄治 / 信田祐 / 熨斗谷充孝,榎户洋司,坂本真绫 / 宫野真守 / 松风雅也 / 铃村健一 / 藤田圭宣 / 斋藤彩夏 / 桐井大介 / 吉住梢 / 子安武人 / 土井美加 / 井上和彦 / 京田尚子 / 立木文彦 / 井上喜久子 / 乡里大辅 / 渡边启 / 根谷美智子 / 上田祐司 / 间宫胡桃 / 山崎树范 / 羽多野涉 / 竹内顺子 / 门胁舞以 / 桑谷夏子 / 田坂秀树 / 鸟海浩辅 / 梶裕贵 / 小林和矢 / 渡边智美 / 成田纱矢香 / 椿理沙 / 石塚小夜里 / 浅井清己 / 三瓶由布子 / 高垣彩阳 / 小野凉子 / 斋贺光希 / 山田美穗 / 笹本优子 / 长岛雄一 / 田村由香里 / 浪川大辅 / 羽鸟靖子 / 泽木郁也 / 佐藤蓝 / 鱼建 / 仲野裕 / 长嶝高士 / 星野充昭 / 川上伦子 / 岩尾万太郎 / 目黑光祐 / 阪田佳代 / 竹谷和树 / 福松进纱 / 原田正夫 / 泽田将考 / 笹田贵之 / 小泽丰 / 伊丸冈笃 / 白熊宽嗣 / 太田哲治 / 杉山大 / 近藤隆 / 增田裕生 / 浅沼晋太郎,2006,2006-04-04(日本),日本,日语,,,,26,24分钟,24,喜剧 / 爱情 / 动画,这是一个发生在贵族学校的故事。私立樱兰高校是日本上流社会的一个缩影。而这个学校最闻名的社团之一，就是六个英俊不凡的男子组成的男公关部。而庶民春绯虽然得以凭借奖学金以特优生的身份进入这个高校，却因为一次偶遇加入公关部工作。青春，友情，爱情，感动，点亮了樱兰高校男公关部，在一系列的爆笑事件中，不一样的感情逐渐萌芽。这的确是一部无忧无虑的青春喜剧童话。
48,https://movie.douban.com/subject/1478064/,人类之子 Children of Men,末代浩劫(港) / 绝种浩劫 / 硕果仅存,人类之子 Children of Men / 末代浩劫(港) / 绝种浩劫 / 硕果仅存,7.6,83148,阿方索·卡隆,阿方索·卡隆 / 蒂莫西·J·塞克斯顿 / 大卫·阿莱塔 / 马克·弗格斯 / 霍克·奥斯比 / P·D·詹姆斯,克里夫·欧文 / 朱丽安·摩尔 / 迈克尔·凯恩 / 克莱尔-霍普·阿什蒂 / 查理·汉纳姆 / 帕姆·费里斯 / 切瓦特·埃加福,2006,2006-09-03(威尼斯电影节) / 2006-09-22(英国),美国 / 英国 / 日本,英语 / 德语 / 意大利语 / 罗马尼亚语 / 西班牙语 / 阿拉伯语 / 格鲁吉亚语 / 俄语 / 塞尔维亚语,109分钟,109,,,,,剧情 / 科幻 / 冒险 / 灾难,20年后的人类社会，正面临着前所未有的灭顶之险——所有的人类都丧失了生育能力，而东欧和非洲国家已经四分五裂，人口向英国等富裕国家大量迁移。 然而在英国境内，人们正陷入一片混乱和恐慌中。人人都为世界末日的到来而焦躁狂暴。非洲女孩肯（克莱尔-霍普•阿什提 Claire-Ho pe Ashitey饰）非法移民到这个国家，但令人振奋的是她腹中竟然怀有孩子。为了保住人类唯一的血脉，警察蒂奥（克里夫•欧文 Clive Owen 饰）和前妻朱丽（朱丽安•摩尔 Julianne Moore 饰）决定不惜一切代价将肯安全离境，但枪林弹雨却使他们举步维艰。 在逃亡中，婴儿出生在了一个难民营里。刀枪当前，保住人类最后的希望，成为蒂奥心中唯一的信念。
49,https://movie.douban.com/subject/1457707/,猫汤 ねこぢる草,Nekojiru-so / Cat Soup,猫汤 ねこぢる草 / Nekojiru-so / Cat Soup,8.7,59408,佐藤龙雄,佐藤龙雄 / 汤浅政明 / Nekojiru(原著),,2001,2001-02-21(日本),日本,日语,33分钟,33,,,,,动画 / 短片 / 奇幻,"根据日本连载漫画 ""Nekojiru Udon"" 改编的动画电影。 猫姐姐病重卧床，灵魂正被死神带走。猫弟弟拼死抢回姐姐的半条命，可是睁开眼睛的姐姐却变得痴痴傻傻。为了找回姐姐的另外半个灵魂，猫弟弟带着姐姐踏上了征程。 诡异的旅途中，不乏血腥与暴力，但也少不了温馨和生趣。他们越过沙漠，穿过大海。遇到了想把他们炖成猫汤的变态，也遇到了好心为他们缝补伤口的老婆婆，还遇到了孩子脾气的上帝，随意拨弄着时间。 最后他们终于找到了姐姐最喜欢的四叶花。"
